nombre_artista,album,fecha,tipo,track
Wim Mertens,"What are we, locks, to do?",2016-06-03,track,Mixed with hellebore
Bohuslav Martinů,Martinů: Julietta,2016-06-10,track,"Julietta, Act II (Sung in German): Ah, endlich da!"
Bohuslav Martinů,Martinů: Julietta,2016-06-10,track,"Julietta, Act II (Sung in German): Vater, alles was heute geschieht, ist wundersam"
Bohuslav Martinů,Martinů: Julietta,2016-06-10,track,"Julietta, Act II (Sung in German): Guten Abend, meine Herrn und Damen!"
Bohuslav Martinů,Martinů: Julietta,2016-06-10,track,"Julietta, Act II (Sung in German): Mesdames et Messieurs"
Bohuslav Martinů,Martinů: Julietta,2016-06-10,track,"Julietta, Act II (Sung in German): Pardon! Monsieur!"
Bohuslav Martinů,Martinů: Julietta,2016-06-10,track,"Julietta, Act III (Sung in German): Alles leer!"
Bohuslav Martinů,Martinů: Julietta,2016-06-10,track,"Julietta, Act II (Sung in German): Sie verlor'n!"
Johann Sebastian Bach,Oratorio de Navidad,2016-12-17,track,"Christmas Oratorio, BWV 248, Cantata 1: Ach mein herzliebes Jesulein! (Chorus)"
Bohuslav Martinů,Martinů: Julietta,2016-06-10,track,"Julietta, Act II (Sung in German): Hoffentlich folgen sie mir nicht?"
Johann Sebastian Bach,Oratorio de Navidad,2016-12-17,track,"Christmas Oratorio, BWV 248, Cantata 2: Coro: Ehre sei Gott in der Höhe"
Bohuslav Martinů,Martinů: Julietta,2016-06-10,track,"Julietta, Act II (Sung in German): Gnade, Freunde, Gnade!"
Ludwig van Beethoven,ベートーヴェン：ピアノ・ソナタ 第 30番、第 31番、第 32番,2016-03-30,track,"ピアノ・ソナタ 第 30番 ホ長調, 作品 109: 1. Vivace, ma non troppo"
Joseph Haydn,Haydn: Opera Gala,2016-01-01,track,"La vera costanza, Hob. XXVIII:8, Act II: Ah, dov'è la mia Rosina?"
Johann Sebastian Bach,"Bach: Magnificat en ré mineur, BWV 243 Kuhnau: Wie schön leuchtet der Morgenstern",2016-11-01,track,"Magnificat en ré majeur, BWV 243: II. Et exsultavit"
Johann Sebastian Bach,"Bach: Magnificat en ré mineur, BWV 243 Kuhnau: Wie schön leuchtet der Morgenstern",2016-11-01,track,"Magnificat en ré majeur, BWV 243: VII. Et misericordia"
Ludwig van Beethoven,ベートーヴェン：ピアノ・ソナタ 第 30番、第 31番、第 32番,2016-03-30,track,"ピアノ・ソナタ 第 30番 ホ長調, 作品 109: 3. Gesangvoll, mit innigster Empfindung: Andante molto cantabile ed espressivo"
Johann Sebastian Bach,Bach: The Gamba Sonatas,2016-11-04,track,"Viola da Gamba Sonata in D Major, BWV 1028: IV. Allegro"
Christoph Willibald Gluck,"Gluck: Iphigenia auf Tauris (Iphigenia in Tauris), Wq. 46",2016-07-01,track,"Iphigenia auf Tauris, Wq. 46, Act IV: Act IV Scene 2: O siehe, Gottin, unsre Tranen (Iphigenie, Orestes, Chorus)"
Wolfgang Amadeus Mozart,Whispering Mozart,2016-11-16,track,"Lobegesang auf die feierliche Johannisloge, K. 148, ""O heiliges Band der Freundschaft"""
George Frideric Handel,"Handel: Imeneo, HWV 41",2016-02-26,track,"Imeneo, HWV 41: Act I: Overture"
Manuel de Falla,Spanish Guitar Masterpieces,2016-10-28,track,"El Sombrero de 3 Picos: El sombrero de 3 picos (The 3-Cornered Hat), Part II: Dance of the Corregidor (arr. S. Behrend for guitar)"
Julia Wolfe,The Stone People,2016-02-12,track,Compassion
Nithyasree Mahadevan,Sri Kamakoti Peetam Alum Maha Periyava,2016-05-22,track,Dhudharinne Mudhalvan
Richard Strauss,Strauss: Ein Heldenleben / Intermezzo: Four Symphonic Interludes,2016-03-11,track,"Ein Heldenleben, Op. 40: 4. Des Helden Walstatt"
Fritz Kreisler,From Fritz to Django,2016-01-01,track,Chanson Louis XIII and Pavane in the Style of Couperin
Johann Sebastian Bach,"Claudio Arrau Plays Mozart & Bach - The Early Recordings, Vol. I",2016-08-26,track,"Sinfonia No. 2 in C Minor, BWV 788 - Remastered"
Tanburi Cemil Bey,Tanburi Cemil Bey Külliyatı,2016-03-04,track,İsfahan Taksim (Viyolonsel)
Wolfgang Amadeus Mozart,Mozart: Waisenhausmesse (Live),2016-05-27,track,"Waisenhausmesse, K. 139, 47a: Qui tollis – Quoniam tu solus - Live"
Dimanche FR,Luxury Classical Collection for Healthy Babies,2016-11-23,track,"Symphony No.1 In C Minor, Op.68 - II. and ante sostenuto"
Albert Roussel,"Roussel: Piano Works, Vol. 2",2016-08-05,track,"Des heures passent, Op. 1: I. Graves et legeres"
Alban Berg,"Ernest Ansermet Collection, Vol. 2: War Requiem, Pt. 2 de Britten et Sept Lieder de jeunesse de Berg",2016-11-16,track,Sept Lieder de jeunesse: VII. Jours d'été
Tushar Dutta,Best of Bandish Fusion,2016-09-19,track,Kesariya Balam
Karol Szymanowski,Chopin & Szymanowski,2016-05-23,track,"Etude, Op. 33, No. 7"
Charles Koechlin,Un siècle de musique française,2016-03-25,track,"The Seven Stars' Symphony, Op. 132: V. Marlene Dietrich"
Dimanche FR,Collection of Luxury Classicals for Healing and Meditation,2016-02-16,track,"Violin Concerto No.2 In B Minor, Op.7 - II. Adagio"
George Frideric Handel,"Handel in Italy, Vol. 2",2016-09-02,track,"Dalla guerra amorosa in B-Flat Major, HWV 102a: La belezza è come un fiore"
Murat Salim Tokac,Kadim Sesler Kadim İzler,2016-04-12,track,Zobalarında Guru da Meşe Yanıyor
Murat Salim Tokac,Aynı Telden Ayrı Dilden (Gayrimüslim Besteciler),2016-04-12,track,Bir Âşık-ı Dil Hastayı Dilşâd Edecek Yok
Max Reger,"Max Reger - Works for Organ - Vol. 5 (Schuke-Orgel, Marktkirche in Halle, Saale)",2016,track,"Zweiundfünfzig leicht ausführbare Vorspiele zu den gebräuchlichsten evangelischen Chorälen für Orgel, Op. 67: No. 34, Schmücke dich, o liebe Seele"
Johannes Brahms,"Michael Gielen Edition, Vol. 3: Brahms",2016-10-14,track,"Symphony No. 4 in E Minor, Op. 98: IV. Allegro energico e passionato - Più allegro"
Johann Sebastian Bach,J.S. Bach: Violin Sonatas & Partitas,2016-04-12,track,"Violin Partita No. 3 in E Major, BWV 1006: II. Loure"
Wolfgang Amadeus Mozart,Mozart: Oboe Concerto & Other Works with Oboe,2016-09-30,track,"Divertimento No. 11 in D Major, K. 251 ""Nannerl Septet"": IV. Menuetto. Theme & Variations"
Pietro Locatelli,Locatelli Capricci for Solo Violin,2016-01-01,track,24 capriccios for Solo Violin: XVII. Capriccio No. 17 in G Major
Richard Wagner,"Wagner: Lohengrin, WWV 75 (Wiener Staatsoper Live)",2016-01-01,track,"Lohengrin, WWV 75, Act III: Habt Dank, ihr Lieben von Brabant! (Live)"
Ole Bull,"The Great Violins, Vol. 2: Niccolò Amati",2016-07-08,track,Aurora
Dimanche FR,Sweet Classicals for Pregnant Mothers,2016-05-18,track,"Piano Concerto No.1 In G Minor, Op.25 - III. Presto - Molto Allegro e vivace"
Giuseppe Verdi,Verdi: Falstaff (Excerpts),2016-01-01,track,Falstaff (Excerpts): Egli scavalca le siepi del giardino
Max Reger,Reger: Complete Works for Violin and Piano & Complete Cello Sonatas,2016-08-26,track,"Cello Sonata No. 3 in F Major, Op. 78: III. Andante con variazioni"
Stephen Dodgson,Stephen Dodgson: Complete Music for Cello & Piano,2016-10-07,track,"2 Romantic Pieces, Set 2: No. 2. Moderato Flessibile"
Richard Strauss,"Strauss: Der Rosenkavalier, Op. 59",2017-09-28,track,"Der Rosenkavalier, Op. 59, Act 1: XI. Die Zeit, die ist ein sonderbar’ Ding (Marschallin)"
Pablo Sorozábal,Los 101 momentos de la Zarzuela,2017-03-31,track,La eterna canción: Romanza de Laura
Ludwig van Beethoven,"Salt Of The Earth ; Beethoven, Dutilleux, Brotons, Garson, Loevendie, Albéniz, Fauré",2017-02-10,track,"Horn Sonata In F Major, Op. 17: III. Rondó"
Manuel de Falla,"Sinfonías de la mañana, Vol. 2",2017-11-24,track,"Falla: 7 Canciones populares españolas: No. 5, Nana"
Henri Dutilleux,"Salt Of The Earth ; Beethoven, Dutilleux, Brotons, Garson, Loevendie, Albéniz, Fauré",2017-02-10,track,Sonatina para Flauta y Piano
Claude Debussy,Dante,2017-05-19,track,"Images, Book 1, L. 110: No. 1, Reflets dans l'eau"
Pablo Sorozábal,Los 101 momentos de la Zarzuela,2017-03-31,track,Don Manolito - Romanza de Margot- Una rosa en su tallo
Richard Strauss,"Strauss: Der Rosenkavalier, Op. 59",2017-09-28,track,"Der Rosenkavalier, Op. 59, Act 1: IX. Da geht er hin, der aufgeblas’ne, schlechte Kerl (Marschallin)"
Juan María Solare,Sombras blancas,2017-11-19,track,Para una mano pequeña
Johannes Brahms,Brahms: Complete Piano Trios and Quartets,2017-11-03,track,"String Sextet No. 1 in B-Flat Major, Op. 18 (arr. T. Kirchner for Piano Trio): II. Andante ma moderato"
Francois Devienne,Flute Concertos,2017-05-26,track,Flute Concerto No. 3 in G Major: II. Romance
Johann Sebastian Bach,甦るソナタ　J. S. バッハ,2017-03-08,track,2本のフルートと通奏低音のためのトリオソナタ ト長調 BWV1039: I. Adagio (with 小谷智子）
Gustav Mahler,"Michael Gielen Edition, Vol. 6: Mahler Symphonies & Orchestral Song Cycles (Recorded 1988-2014)",2017-09-08,track,Symphony No. 5: V. Rondo - Finale. Allegro
George Frideric Handel,Handel: 16 Concertos for Organ and Orchestra,2017-08-17,track,"Organ Concerto No. 3 in G Minor, Op. 4, HWV 291: II. Allegro"
Simone Pedroni,John Williams: Themes And Transcriptions For Piano,2017-07-07,track,"The People's House - From ""Lincoln"""
Johann Sebastian Bach,Música Clásica para Conducir,2017-08-29,track,"Brandenburg Concerto No. 3 in G Major, BWV 1048: I. Allegro"
Wolfgang Amadeus Mozart,Música Clásica para Conducir,2017-08-29,track,"Symphony No. 40 in G Minor, K. 550: I. Molto Allegro"
Wolfgang Amadeus Mozart,Música Clásica para Conducir,2017-08-29,track,"Clarinet Concerto in A Major, K. 622: II. Adagio"
Jean Françaix,"Œuvres du 20ème siècle pour trompette, piano et percussions",2017-10-20,track,Sonatine pour trompette et piano: II. Sarabande
Fritz Kreisler,The Paganini of the Domra: (Live),2017-09-15,track,"3 Old Viennese Dances (Arr. for Domra & Piano): No. 1, Liebesfreud [Live]"
Tom Johnson,Tom Johnson: Plucking,2017-10-06,track,Failing
Dimanche FR,A Collection of Classical Baby Prep Music Like Spring,2017-03-03,track,"Symphony No.8 In B Minor, D.759 - II. Andante con moto"
Reinhold Glière,Glière: Piano Music,2017-04-28,track,"12 Sketches, Op. 47: VII. Agitato"
Evan Bogerd,Sint Bavo Haarlem,2017-01-26,track,"Wenn wir in höchsten Nöten sein, BWV 432 - Choral"
Niels Rønsholdt,Niels Rønsholdt: Songs of Doubt,2017-09-01,track,"Songs of Doubt: No. 6, It's Only You"
Ludwig van Beethoven,The Beethoven Violin Sonatas: Live at Library of Congress,2017-03-17,track,"Violin Sonata No. 5 in F Major, Op. 24 ""Spring"": IV. Rondo: Allegro ma non troppo"
Alice Ping Yee Ho,Celebrating Canadian Women!,2017-05-31,track,Suite for Flute and Piano: II. Scherzo
Marcos Antonio Portugal,O amor brazileiro: Modinhas & lundus do Brasil,2017-07-21,track,"Sucede, Marília bela"
Dietrich Buxtehude,"Orgues du Jura Franco-Suisse, Vol. 1",2017-03-17,track,"Durch Adams Fall ist ganz verderbt, BuxWV 183"
Claude Debussy,"Debussy: Choral Works, Vol. 3",2017-12-01,track,"Debussy: 3 Chansons de Charles d'Orléans, L. 99b: III. Yver, vous n'estes qu'un villain (Second Version)"
Koushik Bhattacharjee,Laagi Lagan (Live) [Indian Classical Vocal],2017-01-15,track,"Raga Bhairavi: ""Jete Jete Churi Kore"" In Addha Taal - Live"
Wolfgang Amadeus Mozart,"Pascal String Quartets, Vol. 1: Mozart's String Quartets",2017-07-21,track,"String Quartet No. 12 in B-Flat Major, K. 172: III. Minuet & Trio"
Modest Mussorgsky,"ARSM I, Vol. 10. Mussorgsky",2017-01-01,track,"Khovanshchina: Introduction ""Dawn Over the Moscow River"" (Arr. Nikolai Rimsky-Korsakov)"
João Carlos Martins,"João, o Maestro - Trilha Sonora Original do Filme",2017-07-01,track,"Partita No. 5 In G Major, Bwv 829: I. Praeambulum"
Erik Satie,Satie: Vexations (840 Times),2017-09-15,track,Vexations (performance 675)
Dinos Constantinides,Dinos Constantinides: Operatic Works,2017-08-04,track,"Imitations, LRC 0939"
Giovanni Paisiello,Paisiello: La grotta di Trofonio (Live),2017-01-13,track,"La grotta di Trofonio, Act II: Act II: Eccomi in pianta, tiseco"
Edvard Grieg,Study Music - Classical Music for Thinking and Concentration (The Night Edition),2017-08-25,track,"Lyric Suite, Op. 54: III. Notturno"
Benjamin Britten,"Britten: The Young Person's Guide to the Orchestra, Op. 34 — Ippolitov-Ivanov: Mtsyri, Op. 54",2017-02-03,track,"The Young Person's Guide to the Orchestra, Op. 34: I. Theme. Tutti, Woodwinds, Brass, Strings, Percussion"
João Carlos Martins,"João, o Maestro - Trilha Sonora Original do Filme",2017-07-01,track,Coda do Terceiro Movimento do Concerto No. 1
Johann Sebastian Bach,Bach: Organ Works,2017-08-01,track,"Trio Sonata for Organ in C Major, BWV 529: I. Allegro"
Wolfgang Amadeus Mozart,"Julian Olevsky, Vol. 1: Mozart Complete Works for Violin & Piano",2017-07-21,track,"Violin Sonata No. 33 in E-Flat Major, K. 481: I. Allegro molto"
Dimanche FR,Peace and Rest in Classical Melodies,2017-09-21,track,"Symphony No.2 In D Major, Op.73 - II. Adagio non troppo"
Alfred Schnittke,Confessions of Faith: Choral Concertos by Bortniansky & Schnittke,2017-02-03,track,"Choir Concerto: III. God, Grant Deliverance from Sin"
André-Ernest-Modeste Grétry,Grétry: L'amant jaloux,2017-02-03,track,"Les fausses apparences, Act II: Jamais le cœur de Léonore (Live)"
Francois-Joseph Gossec,"Grétry, Gossec & Giroust: Grands motets pour Louis XVI",2017-08-18,track,Terribilis est locus iste: Beati qui habitant
André Jolivet,Duodecima Live 1982-85,2017-07-10,track,Serenade for 2 Guitars: I. Preludio e Canzona
Gerald Finzi,Masters of Song,2017-11-03,track,"A Young Man's Exhortation, Op. 14: No. 1, A Young Man's Exhortation"
Dimanche FR,Classical Music Collection for a Warm Weather,2017-07-04,track,"Cello Suite No.4 In E Flat Major, BWV.1010 - IV. Sarabande"
Gideon Klein,Spiritual Resistance: Music from Theresienstadt,2017-09-01,track,"3 Songs, Op. 1: No. 2, Polivina života"
Johann Sebastian Bach,J.S. Bach Suites Orquestales,2018-03-09,track,"Orchestral Suite No. 2 in B Minor, BWV 1067: I. Ouverture"
Giovanni Pierluigi da Palestrina,In Sorrow's Footsteps: Jackson - Palestrina - Allegri - Macmillan,2018-07-20,track,Ave Maria
Johann Sebastian Bach,J.S. Bach Suites Orquestales,2018-03-09,track,"Orchestral Suite No. 3 in D Major, BWV 1068: VI. Gigue"
Antón García Abril,El Hombre y la Tierra (Banda Sonora Original de la Serie de TVE),2018-12-14,track,El Perro y el Trineo: IDITAROD
Antón García Abril,El Hombre y la Tierra (Banda Sonora Original de la Serie de TVE),2018-12-14,track,Juegos de Verano
Antón García Abril,El Hombre y la Tierra (Banda Sonora Original de la Serie de TVE),2018-12-14,track,Llanto para una Amarga Despedida
Luis de Pablo,LmcsL Messa,2018-12-07,track,Liturgia della parola: Salmo responsoriale
Antón García Abril,El Hombre y la Tierra (Banda Sonora Original de la Serie de TVE),2018-12-14,track,Kluane
Antón García Abril,El Hombre y la Tierra (Banda Sonora Original de la Serie de TVE),2018-12-14,track,Desierto de Nieve: IDITAROD
Johann Sebastian Bach,Bach: The Sonatas for Violin & Harpsichord,2018-05-11,track,"Violin Sonata No. 2 in A Major, BWV 1015: IV. Presto"
Antón García Abril,El Hombre y la Tierra (Banda Sonora Original de la Serie de TVE),2018-12-14,track,Glaciares
Antón García Abril,El Hombre y la Tierra (Banda Sonora Original de la Serie de TVE),2018-12-14,track,Bisontes: Serie Canadiense
Luis de Pablo,LmcsL Messa,2018-12-07,track,Liturgia della parola: Acclamazione al Vangelo
Béla Bartók,55 Classical Soundtracks,2018-06-08,track,"Music for Strings, Percussion and Celesta, BB 114: III. Adagio"
Antón García Abril,El Hombre y la Tierra (Banda Sonora Original de la Serie de TVE),2018-12-14,track,Fauna en Peligro: Serie Venezolana
Antón García Abril,El Hombre y la Tierra (Banda Sonora Original de la Serie de TVE),2018-12-14,track,Cataratas Virginia: Serie Canadiense
Antón García Abril,El Hombre y la Tierra (Banda Sonora Original de la Serie de TVE),2018-12-14,track,Campamento de Montaña
Antón García Abril,El Hombre y la Tierra (Banda Sonora Original de la Serie de TVE),2018-12-14,track,Grizzlies Desde el Aire
Antón García Abril,El Hombre y la Tierra (Banda Sonora Original de la Serie de TVE),2018-12-14,track,Territorio del Yukon: Serie Canadiense
Antón García Abril,El Hombre y la Tierra (Banda Sonora Original de la Serie de TVE),2018-12-14,track,Rebecos Blancos en Jasper
Johann Sebastian Bach,J.S. Bach Suites para Violonchelo,2018-01-12,track,"Cello Suite No. 6 in D Major, BWV 1012: V. Gavotte II - Gavotte I"
Antonín Dvořák,"Trio Shaham, Erez, Wallfisch: Schumann, Dvořák, Grieg",2018-01-05,track,"Piano Trio No. 4 in E Minor, Op. 90: IV. Andante moderato - Allegretto scherzando"
Johannes Brahms,Beethoven: Symphony No. 9 & Brahms: Nänie,2018-11-02,track,"Nänie, Op. 82"
Dominick Argento,"Dominick Argento: The Boor, Miss Havisham's Wedding Night, A Water Bird Talk",2018-03-06,track,"The Boor: Scene XI: The Widow, the Boor"
Dominick Argento,"Dominick Argento: The Boor, Miss Havisham's Wedding Night, A Water Bird Talk",2018-03-06,track,"The Boor: Scene X: The Servant, the Boor"
Jean-Philippe Rameau,Les tendres plaintes,2018-01-05,track,"Nouvelles suites de pièces de clavecin, Suite in G Major-Minor: VI. Les sauvages (Arr. S. Nogrette for Guitar)"
Ludwig van Beethoven,"Beethoven Sonata para Piano Nº17 ""La Tempestad""",2018-01-19,track,"Piano Sonata No. 17 in D Minor, Op. 31 No. 2 ""Tempest"": I. Largo - Allegro"
Enrique Granados,Miquel Farré Recital,2018-01-01,track,Valsos poètics (poetic waltzes): Vals No. 5
Johann Sebastian Bach,J.S. Bach Suites para Violonchelo,2018-01-12,track,"Cello Suite No. 6 in D Major, BWV 1012: VI. Gigue"
Johann Sebastian Bach,J.S. Bach Suites para Violonchelo,2018-01-12,track,"Cello Suite No. 4 in E-Flat Major, BWV 1010: IV. Sarabande"
Joseph Haydn,"Haydn 2032, Vol. 6: Lamentatione",2018-06-01,track,"Symphony No. 3 in G Major, Hob.I:3: IV. Finale. Presto"
Antonio Vivaldi,German Brass: Everything for Christmas (Complete Christmas Recordings),2018-11-16,track,"Concerto No. 4 in F Minor, RV 297 ""Winter"": III. Allegro - Arr. By Matthias Höfs"
Johann Sebastian Bach,J.S. Bach Suites para Violonchelo,2018-01-12,track,"Cello Suite No. 6 in D Major, BWV 1012: III. Courante"
Georg Philipp Telemann,Bach/Telemann: Cantatas for Baritone,2018-04-27,track,"Was gibst du denn, o meine Seele, TWV 1:1510: I. Choral"
Antonio Vivaldi,Michala Petri Plays Vivaldi Concertos,2018-06-08,track,"Concerto No. 5 in F Major, RV 434: II. Largo e cantabile"
Antonio Vivaldi,Vivaldi: Concerti per organo,2018-10-19,track,"Violin Concerto in D Major, Op. 3 No. 9, RV 230 (Arr. A. Dawson for Organ): II. Andante"
Gabriel Fauré,Ici-bas - Les mélodies de Gabriel Fauré,2018-11-09,track,Notre amour (feat. Philippe Katerine & JP Nataf)
George Frideric Handel,La magie de la harpe,2018-04-06,track,"Harpsichord Suite No. 11 in D Minor, HWV 437: III. Sarabande"
Wolfgang Amadeus Mozart,Mozart: 6 German Dances,2018-05-26,track,"6 German Dances in F Major, K. 536: V."
Istvan Szekely,Highlights of Radio Musica Clasica,2018-04-25,track,"Ballade No. 4 in F Minor, Op. 52"
Bernat Vivancos,In Montibus Sanctis,2018-11-13,track,Santa Nit
Sérgio de Vasconcellos Corrêa,Sérgio de Vasconcellos-Corrêa - Obras para Piano,2018-05-27,track,Dança Brasileira No. 1
Olena Yuriivna Shostko,Untold,2018-06-29,track,Dreams of You
Dmitri Shostakovich,Shostakovich: Symphony No. 8,2018-10-05,track,"Symphony No. 8 in C Minor, Op. 65: II. Allegretto"
Johann Sebastian Bach,バッハ：ゴ-ルトベルク変奏曲／上杉春雄(ピアノ),2018-07-18,track,"ゴールドベルク変奏曲 ト長調, BWV 988: 第 9変奏 ― 3度のカノン"
Johann Sebastian Bach,Orgelconcert,2018-01-15,track,"Orchester-Suite No. 3 D-dur, BWV 1068: Adagio (Arranged by Sigfrid Karg-Elert) - Live"
Franz Liszt,Complete Erato Recordings,2018-09-14,track,"Liszt: Études d'exécution transcendante, S. 139: No. 2, in A Minor - Molto vivace, ""Fusées"""
An-Lun Huang,An-lun Huang: Piano Music,2018-01-19,track,"Prelude & Fugue in F Minor, Op. 68 No. 3 (Version for Piano): Fugue"
Herbert Howells,The House of the Mind,2018-06-08,track,Regina caeli
Johann Sebastian Bach,バッハ：ゴ-ルトベルク変奏曲／上杉春雄(ピアノ),2018-07-18,track,"ゴールドベルク変奏曲 ト長調, BWV 988: 第 3変奏 ― 1度のカノン"
Wim Mertens,That Which Is Not,2019-02-01,track,Affording More
Wim Mertens,That Which Is Not,2019-02-01,track,Freeze On Volume
Ludwig van Beethoven,Beethoven: Piano Works,2019-10-11,track,"6 Variations on ""Nel cor piu non mi sento"", WoO 70: Var. 6"
Manuel de Falla,Falla: El amor brujo (1915 Version) & El retablo de maese Pedro,2019-05-10,track,"El retablo de maese Pedro: Vais en paz, oh par sin par de verdaderos amantes"
Manuel de Falla,Falla: El amor brujo (1915 Version) & El retablo de maese Pedro,2019-05-10,track,El retablo de maese Pedro: Miren luego vuesas mercedes cómo llevan al moro a la plaza de la ciudad
Pablo Sorozábal,Ametsetan: Basque Songs,2019-01-18,track,"7 Lieder: No. 1, Ametsetan"
Carlos Gardel,La Tropilla,2019-02-09,track,La Novia Ausente
Johann Nepomuk Hummel,"Hummel: Piano Concertos, Vol. 2",2019-11-29,track,"Concerto for Piano and Orchestra in A Major, WoO 24a S.5: III. Rondo"
Radamés Gnattali,Concerto de Choro (Flauta e Violões),2019-05-08,track,Suíte Retratos: IV. Chiquinha Gonzaga - Corta-Jaca
Michael Gielen,Adagios 101,2019-12-20,track,"Piano Concerto No. 2 in B-Flat Major, Op. 19: II. Adagio"
Johann Baptist Vanhal,"Vanhal: Missa Solemnis in E-Flat Major, Stabat Mater in F Major & Symphony in D Major, Bryan D4",2019-04-12,track,Missa solemnis in E-Flat Major: VIa. Agnus Dei
Ariel Ramírez,Sonidos para el Alma,2019-12-02,track,Melodia Desencadenada
Johann Sebastian Bach,Música clásica de violín,2019-04-19,track,"Violin Concerto No. 1 in A Minor, BWV 1041: I. No Tempo Indication"
Antonio Vivaldi,Vivaldi #violin,2019-07-13,track,"Violin Concerto in A Minor, RV 356: II. Largo"
Hector Berlioz,Berlioz: The Complete Works,2019-02-01,track,"Berlioz: Te Deum, Op. 22, H 118: II. Tibi omnes - Hymne"
Erik Satie,100 Best Children's Classics,2019-04-19,track,"Satie: 3 Gymnopédies: No. 1, Lent et douloureux"
Jean-Philippe Rameau,Les Indes Galantes,2019-04-05,track,"Les Indes galantes, RCT 44, Act III: Forêts paisibles"
Antonio Vivaldi,Música clásica de violín,2019-04-19,track,"Le quattro stagioni, Violin Concerto No. 2 in G Minor, RV 315, ""L'estate"": III. Presto"
Rahul Vellal,Ayyo Neneka,2019-01-20,track,Ayyo Neneka
Rahul Vellal,Sodinchi Choodabothe,2019-08-05,track,Sodinchi Choodabothe
Manuel de Falla,Obras Completas (Remastered),2019-09-06,track,El Retablo de Maese Pedro (Cuadro Iii- el Suplicio del Moro) - Remastered
Manuel de Falla,Obras Completas (Remastered),2019-09-06,track,Siete Canciones Populares Españolas (El Paño Moruno) - Remastered
Manuel de Falla,Obras Completas (Remastered),2019-09-06,track,El Amor Brujo (Introducción y Escena) - Remastered
Johannes Brahms,Influences,2019-05-05,track,"String quartet No. 3, Op. 67: III. Agitato (Allegretto non troppo)"
Joseph Haydn,Influences,2019-05-05,track,"String quartet in E-Flat Major, Op. 64 No. 6: II. Andante"
Manuel de Falla,Obras Completas (Remastered),2019-09-06,track,El Retablo de Maese Pedro (Cuadro Iv- los Pirineos) - Remastered
Manuel de Falla,Obras Completas (Remastered),2019-09-06,track,El Retablo de Maese Pedro (Cuadro V- la Fuga) - Remastered
Manuel de Falla,Obras Completas (Remastered),2019-09-06,track,El Amor Brujo (En la Cueva- la Noche) - Remastered
Manuel de Falla,Obras Completas (Remastered),2019-09-06,track,La Vida Breve (Intermedio) - Remastered
Matteo Carcassi,Relaxing Classical Playlist: Music for Day Routine,2019-03-25,track,"Choix D'Airs, Op. 5: No. 3"
Karol Szymanowski,The Best of Martin Jones: Discover Granados,2019-10-04,track,"Four Polish Pieces: IV. Polonaise (Moderato. Festivo, pomposo)"
Roman Berger,Roman Berger: Exodus - Adagio I & II,2019-03-27,track,"Exodus for Organ, Musica profana, dies Irae: No. 2, Swinging"
Mario Castelnuovo-Tedesco,Castelnuovo-Tedesco: Works for Cello & Piano,2019-03-08,track,"Toccata, Op. 83: I. Introduzione"
Jacqueline Fontyn,Affect is no Crime. New Music for Old Instruments,2019-10-25,track,La fenêtre ouverte: II. Un peu indolent... Mais fluide
Jules Massenet,Classical Violin Hits,2019-04-05,track,"Thaïs, Act II: Méditation"
Ignaz Pleyel,Wisps in the Dell,2019-10-04,track,"32 Scottish Folksongs (Excerpts): No. 13, The Ewe Bughts, B. 719 [Arr. for Voice & Chamber Ensemble]"
Franz Danzi,Fesca & Danzi: Psalms,2019-01-18,track,"Preiss Gottes: IX. Danket dem Herrn, denn er ist freundlich. Allegro"
Heitor Villa-Lobos,Chill Classical Guitar (Quality Relaxation),2019-03-15,track,"5 Preludes, W419: No. 5 in D Major - Poco animato"
Carl Philipp Emanuel Bach,Violinsonaten,2019-03-01,track,"Sinfonia in D-Dur, Wq.74, H. 507: II. Andante"
James Whitbourn,Whitbourn: Annelies (Chamber Version),2019-03-01,track,Annelies (Chamber Version): II. The Capture Foretold [Live]
Johann Sebastian Bach,Bach: Complete Cello Suites,2019-09-06,track,"Cello Suite No. 5 in C Minor, BWV 1011: V. Gavottes 1 & 2"
Modest Mussorgsky,Creepy Classical,2019-11-08,track,Pictures at an Exhibition: I. The Gnome (Gnomus)
Charles-Marie Widor,Hommage a Widor,2019-01-28,track,"Organ Symphony No. 4, Op. 13 No. 4: VI. Finale - Live at St. Eskils Church, Stockholm"
Carl Heinrich Graun,"Graun, Telemann & Bach: Wer ist der, so von Edom kömmt",2019-06-07,track,"Wer ist der so von Edom kömmt, Ein Lämmlein geht und trägt die Schuld, GraunWV B:VII:4: No. 10, Was an Strafen ich verschuldet"
Ottorino Respighi,"Respighi: Complete Piano Music, Vol. 1 — Original Piano Works I",2019-08-02,track,"3 Preludes on Gregorian Melodies, P. 131: No. 1, Molto lento"
Claude Debussy,音楽の花束,2019-01-23,track,"2つのアラベスク, L. 66: 1. Andantino con moto"
Johann Sebastian Bach,Bach & Chopin: Piano Works,2019-07-05,track,"English Suite No. 2 in A Minor, BWV 807: I. Prélude"
Johann Sebastian Bach,Songs from Home,2019-07-03,track,"Invention in G Major, BWV 781 (Arr. for Recorder and Guitar)"
Muzio Clementi,Scarlatti & Clementi: Keyboard Sonatas,2019-10-18,track,"12 Monferrine, Op. 49: No. 3 in E Major"
