nombre_artista,album,fecha,tipo,track
Johann Kaspar Mertz,Schubert & Kaspar Mertz: Works for 2 Guitars,2020-06-26,track,"3 Nänien ""Trauerlieder"": No. 2, Ich denke Dein"
Antonín Dvořák,Timmy und die Musik in Amerika,2020-08-07,track,"Symphony No. 9 in E Minor, Op. 95, B. 178 ""From the New World"" (Excerpts Arr. for Small Ensemble): I. Adagio - Allegro Molto"
Luigi Boccherini,Philharmonia 75 Carlo Maria Giulini,2020-02-28,track,Overture in D Major
Ludwig van Beethoven,Beethoven: König Stephan & Other Choral Works,2020-01-10,track,"König Stephan, Op. 117: No. 9, Heil unsern Enkeln!"
Carl Nielsen,Nielsen: Complete Works for Violin Solo & Violin and Piano,2020-09-11,track,"Prelude, Theme & Variations, Op. 48, FS 104: Var. 3, Andante espressivo"
Wolfgang Amadeus Mozart,Mozart - Serenades,2020-08-01,track,"Serenade No. 9 in D Major, K. 320 ""Posthorn"": I. Adagio maestoso - Allegro con spirito"
Johannes Brahms,Organ Transcriptions: Stefan Schmidt Plays the Klais Organ of Würzburg Cathedral,2020-11-20,track,"Variations & Fugue on a Theme by Handel, Op. 24 (Arr. M. Schmeding for Organ): Aria - Vars. 1-25"
Gaspare Spontini,"Spontini: Fernand Cortez, ou la conquête du Mexique (Live)",2020-04-17,track,"Fernand Cortez, ou la conquête du Mexique, Act I Scene 1: Quittons ces bords (Live)"
Ludwig van Beethoven,"Beethoven 250 Fidelio Overture, Symphony No.7, the Creatures of Prometheus",2020-04-03,track,"Symphony No. 7 in a Major, Op. 92: IV. Allegro Con Brio"
Ludwig van Beethoven,"Beethoven: Complete Bagatelles, Diabelli & Eroica Variations",2020-03-27,track,"Thirty-three Variations on a Waltz by Diabelli, Op. 120: Variation 24"
Alaturka Records,Çocuk,2020-10-07,track,Bir Penbe İncisin Sen
Francisco Tárrega,Ars de Pulsatione,2020-07-12,track,Sueño
Claude Debussy,"Debussy: Preludes, Book 1 (Live)",2020-12-04,track,"Préludes, Livre 1, L. 117: VIII. La fille aux cheveux de lin"
Ludwig van Beethoven,Beethoven - Quatuors à cordes,2020-03-13,track,"String Quartet No. 14, Op. 131: V. Presto"
Ludwig van Beethoven,"Beethoven: Piano Variations, Vol. 2 – Op. 76, WoO 63, 68, 73, 76, 77 & Anh. 10",2020-10-23,track,"9 Variations on a March by Dressler, WoO 63: Var. 5"
John McCormack,Irish Songs of Songs,2020-04-08,track,Kathleen Mavourneen
Georges Bizet,Clássica Hits: Festa,2020-07-11,track,Carmen Suite No. 1: VI. Les Toréadors
Johann Sebastian Bach,Bach unbegrenzt,2020-04-25,track,"Brandenburg Concerto No. 4 in G Major, BWV 1049: I. Allegro"
Ralph Vaughan Williams,Philharmonia 75 Sir John Barbirolli,2020-03-06,track,Symphony No. 5 in D Major: II. Scherzo
Modest Mussorgsky,Moussorgski: Tableaux d'une exposition,2020-11-20,track,Tableaux d'une exposition: I. Promenade (Transcription pour orgue et trompette)
Arthur Somervell,Somervell: Maud & A Shropshire Lad,2020-05-15,track,Shepherd's Cradle Song
Ludwig van Beethoven,"Beethoven: Variations, Vol. 2",2020-10-23,track,"12 Variations on ""Menuet a la vigano"", WoO 68: Var. 9"
Claudio Monteverdi,Salve sancta parens,2020-06-12,track,"Mass for 4 Voices, SV 190: III. Credo"
Dietrich Buxtehude,"Voices of the Hanse, Vol. 1",2020-08-28,track,"Ich ruf zu dir, Herr Jesu Christ, BuxWV 196"
Ludwig van Beethoven,"Beethoven: Piano Sonatas, Vol. 8",2020-03-06,track,"Piano Sonata No. 8 in C Minor, Op. 13 ""Pathétique"": II. Adagio cantabile"
Germaine Tailleferre,"Tailleferre, Auric & Durey: Works for Piano",2020-03-01,track,Pastorale in A-Flat Major
Alessandro Scarlatti,The Evolution of the String Quartet,2020-09-18,track,Sonata à quattro No. 3 in G Minor: II. Grave
Johann Sebastian Bach,Bach: Harpsichord Works,2020-05-22,track,"English Suite No. 6 in D Minor, BWV 811: II. Allemande"
Maurice Ravel,Best of Ravel,2020-08-01,track,"Boléro, M. 81: Moderato assai"
Manuel de Falla,Kreisler & Others: Violin Works,2020-08-07,track,La vida breve: Danse espagnole (Arr. for Violin & Piano)
Antonio Soler,Road to Cordoba,2020-02-06,track,"Antonio Soler: Sonata No.84 in D Major, R.413"
Luigi Dallapiccola,Modern Times Edition,2020-02-07,track,Partita for Orchestra: I. Passacaglia
O. S. Thyagarajan,Chidanandam - O. S. Thyagarajan (Live at Chidambaram),2020-05-01,track,Vatapi - Hamsadwani - Adi - Live
Vyacheslav Artyomov,Vyacheslav Artyomov: Album XI,2020-05-08,track,Litany I
Julian Byzantine,55 South American Classical Hits,2020-10-17,track,Suite Venezolana: IV. Valse
Isaías Sávio,"Pereira, Villa-Lobos, Reis & Others: Works for Guitar",2020-04-10,track,Batucada
Johann Sebastian Bach,J.S. Bach: Harpsichord Works,2020-02-14,track,"Prelude & Fugue in A Minor, BWV 894: I. Prelude"
Peter Dickinson,Peter Dickinson: Chamber & Instrumental Music,2020-01-17,track,Violin Concerto: IIc. Tranquillo (Version for Violin & Piano)
Elmira Darvarova,Music from Five Centuries: 17th - 21st,2020-01-17,track,"Pièces de viole, Book 2: No. 20, Les folies d'Espagne (Arr. H. Wall & E. Darvarova)"
Dimanche FR,Sleeping Classical Music for Comfortable Sleep,2016-02-12,track,"Cello Suite No.2 In D Minor, BWV.1008 - III. Courante"
Antonín Dvořák,Me gusta el violoncelo! (Menuetto Kids - Música clásica para niños),2016-12-16,track,"Cello Concerto in B Minor, Op. 104: II. Adagio ma non troppo (Excerpt)"
Ludwig van Beethoven,Mozart: Piano Sonatas Nos. 10 & 16 - Beethoven: 11 Bagatelles - Chopin: Tarantella,2016-07-01,track,"11 Bagatelles, Op. 119: No. 4 in A Major"
Hans Werner Henze,Henze: Orchestral Works,2016-06-03,track,7 Boleros: I. La irascible (Die Jähzornige)
Ludwig van Beethoven,Beethoven Hits,2016-11-25,track,"Triiple Concerto in C Major, Op. 56: II. Largo"
Tanburi Cemil Bey,Tanburi Cemil Bey Külliyatı,2016-03-04,track,Zavil Taksim (Kemençe)
Charles-Marie Widor,"Organ Concert in Marburg, Germany",2016-10-04,track,"Symphonie No. 4 in F Minor, Op. 13/4: VI. Finale - Live"
Franz Schmidt,Schmidt: Das Buch mit sieben Siegeln,2016-09-04,track,"Das Buch mit sieben Siegeln, Prologue: Prologue: Nun sah ich und siehe (Johannes, Chorus, Quartet)"
Grigory Frid,Frid: Complete Music for Viola & Piano,2016-01-01,track,"Sonata for Viola & Piano No. 2, Op. 78: III. Catharsis: Sostenuto assai e poco rubato - Doppio movimento - Tranquillo"
Johann Sebastian Bach,J.S. Bach: Christmas Oratorio,2016-10-21,track,"Christmas Oratorio, BWV 248, Cantata No. 6: VII. Evangelist. ""Und Gott befahl ihnen im Traum"""
Farida Khanum,Muqabil Se Aaye Hain,2016,track,Muqabil Se Aae Hain
Ludwig van Beethoven,"Emil Gilels 100, Vol. 3",2016-01-01,track,"Piano Sonata No. 28 in A Major, Op. 101: I. Etwas lebhaft und mit der innigsten Empfindung - Allegretto, ma non troppo"
Alessandra Celletti,Journey to Prague,2016-04-01,track,On an Overgrown Path: II. A Blown Away Left
Erik Satie,Erik Satie - Essential Piano Music,2016-06-24,track,En habit de cheval: II. Fugue litanique
Georg Philipp Telemann,"Telemann Edition, Vol. 3",2016-11-18,track,"Trio Sonata in A Minor, TWV 42:a7: I. Andante, II. Allegro, III. Adagio, IV. Allegro"
Wu Han,Wu Han Live II,2016-11-28,track,"Piano Quintet No. 1 in C Minor, Op. 1: I. Allegro (Live)"
Thomas Oboe Lee,Thomas Oboe Lee: Twenty-Nine Fireflies (1977-2002),2016-10-11,track,Firefly XXI
Gioachino Rossini,Christa Ludwig,2016-01-01,track,"La Cenerentola: Liebste ... Ramiro, verzeiht mir (Sung in German)"
Jean-Philippe Rameau,Récréation de musique,2016-03-04,track,"Thétis, RCT 28: Quel aveugle transport vous guide?"
Hans Pfitzner,"Pfitzner: Palestrina, WoO 17 (Bayerische Staatsoper Live)",2016-01-01,track,"Palestrina, WoO 17: Prelude (Live)"
Wolfgang Amadeus Mozart,Chamber Music,2016-10-19,track,"String Quartet No. 14 in G Major, K. 387: II. Menuetto"
George Frideric Handel,100 Best: Handel,2016-06-10,track,"Concerto Grosso in E Minor, HWV 321: V. Allegro, ma non troppo"
Johann Simon Mayr,Mayr: Amor non soffre opposizione,2016-10-14,track,"Amor non soffre opposizione, Act I: Io d'altro amante in braccio!"
Dimanche FR,Happy Healing Time with Bach,2016-03-14,track,"Brandenburg Concerto No.5 In D Major, BWV.1050 - II. Affettuoso"
Michael Finnissy,Michael Finnissy: Beat Generation Ballads,2016-07-01,track,Beat Generation Ballads: V. Veränderungen
Georg Philipp Telemann,Telemann: 12 Fantasien für Querflöte ohne Bass,2016-10-07,track,"12 Fantasien für Querflöte ohne Bass: Nr. 10 fis-Moll, TWV 40:11"
Dimanche FR,A Collection of Luxury Classics for the Healing of the Mind,2016-02-22,track,"Octet for Strings In E Flat Major, Op.20 - II. Andante"
Johann Sebastian Bach,Bach Cantatas,2016-01-01,track,"Wachet auf, ruft uns die Stimme, BWV 140: Aria Duet: Mein Freund ist mein (Soprano, Bass)"
Wolfgang Amadeus Mozart,Recordings 1967 - 1977,2016-11-01,track,"Un moto di gioia, K 579"
Jean-Philippe Rameau,Mi palpita il cor: Baroque Passions,2016-10-14,track,Orphée: Inutiles regrets
Jules Massenet,Voix suprême: Melodies of Jules Massenet,2016-01-08,track,Chanson désespérée
Dimanche FR,Symphonies for Happy Sleep,2016-03-29,track,"Symphony In C Major, WD.33 - II. Adagio"
Stephen Chatman,Chatman: Choir Practice,2016-05-13,track,Choir Practice: Isn't My Marilyn Talented? (Live)
Jean Sibelius,"Pyotr Ilyich Tchaikovsky: Violin Concerto - Jean Sibelius: Violin Concerto, Humoresques Op. 87 Nos. 1 & 2",2016-02-01,track,"Humoresque in D Major, Op. 87 No. 2"
Dimanche FR,Beautiful Mom-Baby Time with Classical Music,2016-02-23,track,"Piano Trio No.4 In E Minor, Op.90 - III. Andante - Vivace non troppo"
Johann Sebastian Bach,Godowsky: The Art of Transcription,2016,track,"Violin Sonata in G Minor, BWV 1001: IV. Presto"
Hector Berlioz,"Berlioz: Roméo et Juliette, Marche troyenne & Chasse royale et orage",2016-09-01,track,"Roméo et Juliette, Op. 17, H. 79, Pt. 1: 2. Strophes. Bientôt de Roméo la pâle rêverie (Tenor, Chorus)"
Benjamin Britten,Under the Greenwood Tree: Songs of Love & Nature,2016-01-01,track,"A Midsummer Night's Dream, Op. 64, Act I: I know a bank where the wild thyme blows"
Johann Sebastian Bach,Best of J.S. Bach,2016-10-07,track,"Was mir behagt, ist nur die muntre Jagd!, BWV 208 ""Hunt Cantata"": Schafe können sicher weiden"
Dimanche FR,Sleeping Classical Collection That Relieves Fatigue of the Day,2016-09-21,track,"Piano Concerto No.2 In B Flat Major, Op.83 - II. Allegro appassionato"
Wolfgang Amadeus Mozart,"The Koroliov Series, Vol. 18",2016,track,"Piano Sonata No. 13 in B-Flat Major, K. 333 ""Linz"": III. Allegretto grazioso"
Johann Sebastian Bach,Schumann: Cellokonzert A-Moll - Tschaikowsky: Rokoko-Variationen,2016-09-30,track,"Cello Suite No. 2 in D Minor, BWV 1008: II. Allemande - Remastered"
Erik Satie,Satie: Complete Piano Music,2016-04-01,track,Sports et divertissements: XX. Le feu d'artifice
Olivier Messiaen,Messiaen: Livre d'orgue & Individual Works,2016-11-11,track,"Livre d'orgue, I/38: No. 1, Reprises par interversion"
Franz Schubert,"Beethoven: Symphony No. 5 in C Minor, Op. 67 - Schubert: Symphony No. 8 in B Minor, D. 759 ""Unfinished""",2016-10-01,track,"Symphony No. 8 in B Minor, D. 759 ""Unfinished"": II. Andante con moto"
Dimanche FR,Dancing With Johann Strauss Ii (Waltz Suite),2016-07-20,track,Strauss II: Gschichten Aus Dem Wienerwald Op. 325
Gioachino Rossini,"O sole mio, Vol. 2",2016-07-01,track,"Soirées musicales: Les soirees musicales: No. 8. La danza (arr. E. Monti for voice, mandolin ensemble and orchestra)"
Ralph Vaughan Williams,Vaughan Williams: Sir John in Love,2016-03-11,track,"Sir John in Love, Act III: Prelude - Yet Hear Me Speak"
Ludwig van Beethoven,Beethoven: Symphonies Nos. 1-9,2016-08-05,track,"Symphony No. 6 in F Major, Op. 68 ""Pastoral"": I. Awakening of Cheerful Feelings upon Arrival in the Country"
Ferdinand Hiller,"Hiller, R. Schumann & Reinecke: Works for Piano & Orchestra",2016-01-01,track,"Piano Concerto in F-Sharp Minor, Op. 69: I. Moderato, ma con energia e con fuoco"
Ludwig van Beethoven,The Essentials: Cello,2017-02-17,track,"12 Variations on ""See the Conqu'ring Hero Comes"", WoO 45: Var. 4"
Duke Ellington,"Jazz Archives Presents: ""If Dreams Come True"" Duke Ellington at the Cotton Club,1938 (Volume One)",2017-02-27,track,Dinah - Live
Leopold Koželuch,The Key Collection: 3 Centuries of Rare Keyboard Gems,2017-03-17,track,"Piano Sonata in E-Flat Major, Op. 10 No. 1, P. XII:15: III. Allegretto"
Johann Sebastian Bach,13 Strings,2017-05-26,track,"Violin Partita No. 2 in D Minor, BWV 1004: IV. Gigue"
Endre Szervánszky,Relaxing Flute Collection,2017-02-24,track,"Trio for Flute, Violin and Viola"
Tadeusz Szeligowski,Canto for Winds,2017-05-19,track,Wind Quintet: II. Andante cantabile
Harry Burleigh,Music by Composers of African Descent,2017-07-07,track,4 Southland Sketches: 1. Andante
Dimanche FR,Happy Imagination with Luxury Classicals,2017-11-13,track,"Symphony No.9 In E Minor, Op.95 - II. Largo"
Erik Satie,Satie: Vexations (840 Times),2017-09-15,track,Vexations: Vexations (performance 481)
Erik Satie,Satie: Vexations (840 Times),2017-09-15,track,Vexations (performance 704)
Franz Liszt,Midnight Piano Classics,2017-03-17,track,"Liebesträume, S. 541: No. 3 in A-Flat Major 'Oh Lieb, so lang du lieben kannst'"
Samuel Barber,Tides of Life,2017-01-01,track,"Dover Beach, Op. 3: ""The sea is calm to‑night"" (String Orchestra Arr.)"
Ludwig van Beethoven,"The Koroliov Series, Vol. 20",2017,track,"Diabelli Variations, Op. 120: Var. 7, Un poco più allegro"
Wolfgang Amadeus Mozart,Mozart 225 - The Late Operas,2017-06-01,track,"Così fan tutte, K.588: Overture - Live"
Jaan Rääts,Grands concertos néo-classiques,2017-10-20,track,"Konzert für Trompete, Klavier und Orchester"
Roberto Gerhard,Spanish Cello Sonatas,2017-06-16,track,Cello Sonata: III. Molto vivace
Béla Bartók,"Bartók, Vol. 4: Complete Works for Piano Solo & Bartók for Children",2017-10-06,track,"For Children, Sz. 42 Vol. 1 (Revised Version): No. 8, Children's Game. Allegretto"
Johannes Brahms,"Brahms, Schubert & Schumann, Piano Works",2017-07-21,track,"8 Klavierstücke, Op. 76: No. 2. Capriccio in B Minor"
Dimanche FR,Feast of Romantic Music with Brahms,2017-04-04,track,"Symphony No.4 In E Minor, Op.98 - II. and ante moderato"
Laurence Crane,Laurence Crane: Pieces About Art (Live),2017-11-17,track,Pieces About Art - Live
Erik Satie,Satie: Vexations (840 Times),2017-09-15,track,Vexations: Vexations (performance 319)
Mauro Giuliani,Violão de Todos os Tempos,2017-07-01,track,"Le Narcisse (Narciso), Op. 46 No. 7"
Ernest John Moeran,The British Cello,2017-10-20,track,Prelude for Cello & Piano
Johann Sebastian Bach,Tokyo University of the Arts (Geidai): From Classics to Traditional Japanese Music Performed by Recommended Students!,2017-06-07,track,"Violin Partita No. 2 in D Minor, BWV 1004: V. Chaconne"
Joseph Haydn,Haydn: Les sept dernières paroles du Christ en Croix,2017-03-10,track,"Les sept dernières paroles du Christ en croix, Hob.XX:1: II. Père, pardonne-leur car ils ne savent pas ce qu'ils font"
Béla Bartók,"Bartók, Vol. 4: Complete Works for Piano Solo & Bartók for Children",2017-10-06,track,"For Children, Sz. 42 Vol. 1 (Revised Version): No. 12, Allegro"
Dinu Lipatti,Dinu Lipatti (100th Anniversary Edition),2017-07-21,track,"Piano Concertino in the Classical Style, Op. 3: III. Allegretto (Recorded Live 1943)"
Dimanche FR,Time of Meditation with Classical Music,2017-03-15,track,"Symphonie Espagnole In D Minor, Op.21 - IV. Andante"
Wolfgang Amadeus Mozart,Polonaise-fantaisie: The Story of a Pianist,2017-07-14,track,"Fantasy No. 3 in D Minor, K. 397"
Wolfgang Amadeus Mozart,Mozart 225 - The Middle Operas,2017-06-01,track,"Zaide, K.344 / Act 1: ""Herr und Freund!"""
Johann Sebastian Bach,J.S. Bach: The Well-Tempered Clavier,2017-02-03,track,"The Well-Tempered Clavier, Book 2: Prelude No. 9 in E Major, BWV 878"
Christoph Willibald Gluck,Maria Callas Live - Remastered Live Recordings 1949-1964,2017-09-15,track,"Gluck: Iphigénie en Tauride, Wq. 46, Act 2: ""Onorate con me quest'eroe ... "" (Iphigénie) [Live]"
Igor Stravinsky,"Go East! Stravinsky, Brahms, Hindemith & Manav",2017-02-17,track,"The Rite of Spring, K015, Pt. 2 (Arr. Piano 4 Hands): XIII. Ritual Action of the Ancestors"
Dimanche FR,Cheerful Classicals for Brain Activation,2017-07-05,track,"Sinfonia No.1 In C Major, BWV.787"
Gideon Klein,Spiritual Resistance: Music from Theresienstadt,2017-09-01,track,"3 Songs, Op. 1: No. 1, Vodotrysk"
Dimanche FR,A Collection of Luxury Classics for a Relaxing Break,2017-07-18,track,"Piano Concerto No.1, Op.15 - II. Largo"
Mauro Giuliani,Tres Sonatas de Mauro Giuliani para Flauta y Guitarra,2017-04-18,track,Serenata Op. 127: IV. Variación I
Ludwig van Beethoven,DUO 5,2017-06-28,track,ヴァイオリン・ソナタ 第3番 変ホ長調 Op. 12-3: I. Allegro con spirito
Bo Gunge,Gunge: 12 Studies,2017-12-01,track,"12 Studies (Version for Piano): No. 4, Blues Without Words"
Ludwig van Beethoven,Classic Ranking Top 50,2017-05-01,track,"Piano Sonata No. 8 in C Minor, Op. 13 ""Pathétique"": II. Adagio cantabile"
João Carlos Martins,"João, o Maestro - Trilha Sonora Original do Filme",2017-07-01,track,"Partita No. 5 In G Major, Bwv 829: I. Praeambulum"
Wolfgang Amadeus Mozart,"Loewenguth Quartet, Vol. 1: Haydn & Mozart",2017-08-18,track,"String Quartet No. 17 in B-Flat Major, K. 458 ""Hunt"": I. Allegro vivace assai"
George Frideric Handel,Haandel: 9 Deutsche Arien,2017-09-01,track,"In den angenehmen Büschen, HWV 209"
Detlev Glanert,Glanert: 4 Präludien und Ernste Gesänge & Weites Land - Brahms: Clarinet Sonata No. 1,2017-01-13,track,"4 Präludien und Ernste Gesänge (After J. Brahms' 4 Serious Songs, Op. 121): No. 2, Prelude. Andante"
Dimanche FR,Bright and Calm Classical Music Collection for Comfortable Sleeping,2017-02-10,track,"Violin Concerto In D Major, Op.35 - II. Canzonetta. Andante"
George Frideric Handel,Handel: 9 Deutsche Arien,2017-07-07,track,"18 Pieces for a Musical Clock, Set 2: A Voluntary or a Flight of Angels in C Major, HWV 600 (Arr. for 2 Lutes)"
Charles Koechlin,Koechlin: Orchestral Works,2017-10-13,track,"Offrande musical sur le nom de Bach, Op. 187: VII. Feuillet d'album"
Johann Kaspar Mertz,Bardic Song,2017-03-17,track,"Schule für die Gitarre, WoO 2: No. 9. Romanze"
Anton Bruckner,Bruckner: Symphonies Nos. 2-9,2017-10-13,track,"Symphony No. 5 in B-Flat Major, WAB 105 (1878 Version): IV. Finale. Adagio - Allegro moderato"
Gustav Mahler,"Michael Gielen Edition, Vol. 6: Mahler Symphonies & Orchestral Song Cycles (Recorded 1988-2014)",2017-09-08,track,"Des Knaben Wunderhorn: No. 3, Trost im Unglück"
Dimanche FR,Classical Music Collection for a Clear and Beautiful Mind,2018-09-18,track,"Symphony No.4 In B Flat Major, Op.60 - II. Adagio"
Johann Sebastian Bach,"Bach: The Well-Tempered Clavier, Book 2",2018-05-18,track,"The Well-Tempered Clavier, Book 2: Prelude & Fugue No. 16 in G Minor, BWV 885"
Ludwig van Beethoven,The Stuttgart Recordings,2018-05-04,track,"Die Ruinen von Athen, Op. 113: Overture"
Samuel Adler,A Prophecy of Peace: Choral Music of Samuel Adler,2018-08-31,track,I Think Continually of Those
Paul Hindemith,"Hindemith: Ludus Tonalis - Hartmann: Piano Sonata ""27 April 1945""",2018-06-01,track,"Ludus tonalis: No. 16, Fugue No. 8 in D Major. With Strength"
Ottorino Respighi,2016 Midwest Clinic: Ed W. Clark High School Orchestra (Live),2018-03-15,track,"Ancient Airs & Dances, Suite No. 3, P. 172: I. Italiana (Live)"
Igor Stravinsky,Stravinsky: Music for Piano Solo and Piano & Orchestra,2018-01-19,track,Concerto for Piano & Wind Instruments: III. Allegro - Agitato
Benet Casablancas,"Benet Casablancas, retrat d'artista",2018-06-01,track,Tres Interludis per a orquestra: III
Hubert Parry,"Parry: 12 Sets of English Lyrics, Vol. 3",2018-11-16,track,"English Lyrics, Set 10: No. 5, From a City Window"
Joseph Haydn,Haydn: Masses,2018-05-18,track,"Mass No. 2 in F Major, Hob. XXII:1 ""Brevis"": VIa. Agnus Dei"
Roberto Sierra,"Sierra: Kandinsky, Clarinet Sonata & 33 Ways to Look at the Same Object",2018-05-11,track,"33 Formas de Mirar un Mismo Objeto: No. 29, —"
Orlande de Lassus,Lassus: St. Matthew Passion,2018-02-09,track,"Passio Domini nostri Jesu Christi secundum Matthaeum: Mors tua, mors Christi"
Jaroslav Krcek,Krček: Vocal Music,2018-03-02,track,Mass No. 10: I. Kyrie
Leonard Bernstein,"Bernstein: Prelude, Fugue and Riffs & Three Dance Episodes from ""On the Town"" & Serenade & Fancy Free",2018-10-26,track,"Serenade after Plato's ""Symposium"" for Solo Violin, Strings, Harp and Percussion: III. Erixymathus (Presto)"
Johannes Brahms,Brahms: The Late Piano Works,2018-06-19,track,"Seven Fantasias, Op. 116 - Intermezzo - Andantino Teneramente"
Gustav Mahler,Lieder eines fahrenden Gesellen,2018,track,"﻿Lieder eines fahrenden Gesellen: No. 2, Ging heut morgen über's Feld"
Amanda Rontgen-Maier,Ladies' Night,2018-01-19,track,"6 Pieces for Violin & Piano: No. 2, Allegro con moto"
Claude Debussy,Debussy: The Complete Piano Works,2018-03-09,track,"Debussy: La boîte à joujoux, CD 136, L. 128: VI. Épilogue"
Kaija Saariaho,Saariaho x Koh,2018-11-09,track,Cloud Trio: IV. Tranquillo ma sempre molto espressivo
Franz Liszt,Souvenirs,2018-01-05,track,"Glanes de Woronince, S. 249: III. Complainte"
Pehr Henrik Nordgren,Evocations,2018-05-18,track,"String Quintet, Op. 110: II. —"
Giuseppe Verdi,Verdi: La traviata,2018-03-02,track,"La traviata, Act II: Alfredo Voi!"
Roxanna Panufnik,Now May We Singen: Music for Advent and Christmas,2018-12-03,track,Angels Sing: Jesus Christ is Born
Marcus Blunt,Marcus Blunt: Orchestral Works,2018-01-19,track,Piano Concerto: I. Molto moderato
Wolfgang Amadeus Mozart,"Sacred Masterpieces Stuttgart Gachinger Kantorei, Stuttgart Bach Collegium, Rilling",2018-01-05,track,"Handel - Messiah, K. 572 (Sung in German): Denn die Herrlichkeit Gottes des Herrn (Chorus)"
Benjamin Britten,Much Ado About Nothing,2018-01-05,track,"3 Divertimentos: No. 3, Burlesque. Presto"
Paul Hindemith,"János Starker Plays Hindemith, Prokofiev & Rautavaara",2018-05-18,track,Cello Concerto: II. Ruhig bewegt - Sehr lebhaft - Im früheren langsamen Zeitmaß
Roman Maciejewski,Maciejewski: Piano Music,2018-04-06,track,Mazurka (Version 2)
Johann Sebastian Bach,バッハ：ゴ-ルトベルク変奏曲／上杉春雄(ピアノ),2018-07-18,track,"ゴールドベルク変奏曲 ト長調, BWV 988: 第 6変奏 ― 2度のカノン"
Carl Philipp Emanuel Bach,Complete CPE Bach,2018-01-05,track,"Flute Sonata in C Major, Wq. 73: III. Allegretto"
Franco Margola,Margola: Complete Piano Works,2018-07-06,track,"Mosaico, DC 95: I. Danza"
Joseph Haydn,Haydn: 12 Menuetti di ballo & Baryton Trios Nos. 75 and 124,2018-06-22,track,"12 Menuetti di ballo, Hob. IX:11 ""Redout"": No. 3 —"
Johann Sebastian Bach,"Bach: St. Mark Passion, BWV 247",2018-04-06,track,"St. Mark Passion, BWV 247 (Reconstr. K. Böhmer, A. Glöckner & D. Hellmann): No. 19, Betrübtes Herz, sei wohlgemut"
Ludwig van Beethoven,Portrait (Live),2018-01-05,track,"Symphony No. 4 in B-Flat Major, Op. 60: IV. Allegro ma non troppo - Live"
Wolfgang Amadeus Mozart,Classically Classical,2018-05-21,track,"Piano Quartet No. 1 in G Minor, K. 478: I. Allegro"
Dmitri Shostakovich,Shura Cherkassky Piano Masterpieces,2018-10-05,track,"Piano Concerto No. 1 in C Minor, Op. 35: IV. Allegro con brio"
Paweł Łukaszewski,Łukaszewski: Musica Profana 2,2018-07-27,track,"8 Songs for Children: No. 7, Choinka w lesie"
John Beckwith,"Beckwith: Calling – Instrumental Works, 2006-2016",2018-02-16,track,Follow Me: III. —
Miguel Proença,Grande Fantasia Triunfal sobre o Hino Nacional Brasileiro,2018-09-14,track,Grande Fantasia Triunfal sobre o Hino Nacional Brasileiro
Jonathan Dove,Jonathan Dove: A Brief History of Creation & Gaia Theory,2018-09-21,track,A Brief History of Creation: VII. Trees
Joseph Haydn,Rosbaud Conducts Haydn,2018-03-09,track,"Symphony No. 90 in C Major, Hob. I:90: IV. Finale. Allegro assai"
Pärt Uusberg,"Pärt Uusberg: Choral Music, Vol. 1",2018-10-05,track,"Psalm of David No. 121, Pt. 2"
Marcel Dupré,Voilà! Ça Y Est! - Symphonic Organ Music At The Jesuitenkirche In Vienna,2018-08-17,track,"Cortège Et Litanie, Op. 19: 2"
Johann Sebastian Bach,Passion (Live),2018-04-20,track,"St. John Passion, BWV 245, Pt. 2: No. 26, In meines Herzens Grunde (Live)"
Dimanche FR,Clear Melodious Classicals with Meditation,2018-08-16,track,"Violin Sonata No.2 In A Major, Op.100 - III. Allegretto grazioso"
Svend Westergaard,The Royal Danish Academy of Music 150 years,2018-01-19,track,"String Quartet, Op. 28: I. Andante con alcuna licenza - Allegro con fuoco"
Lalgudi G. Jayaraman,Nada Sagaram: Live Concert by Maestros,2018-06-29,track,Appaduru - Kamas - Adi
Pancho Vladigerov,Pancho Vladigerov: Aquarelles (Miniatures for Piano),2018-10-19,track,"Episodes for Piano, Op. 36: No. 4, Improvisation"
Dimanche FR,Classical Melodies That Improves Concentration,2018-01-05,track,"Hungarian Rhapsody No.2 In C Sharp Minor, S.359"
Steven Bryant,2017 National Intercollegiate Band: 70th Anniversary (Live),2018-01-19,track,Miniature Suite: IV. The Low Arc of the Sun (Live)
Benjamin Broening,Somewhere,2019-09-27,track,Arioso/Doubles
Franz Schubert,The Brigitte Fassbaender Edition,2019-06-07,track,"Schwanengesang, D.957: 7. Abschied"
Charles Koechlin,Reason in Madness,2019-04-05,track,"Chansons de Bilitis, Op. 39: No. 1, Hymne à Astarté"
Mieczysław Karłowicz,Mieczyslaw Karłowicz - pieśni zebrane - Polska Liryka Wokalna,2019-11-08,track,"Przed Nocą Wieczną, Op. 3: No. 6"
Joseph Haydn,Ausgewählte Lieder und Arien (Live),2019-02-08,track,"6 Original Canzonettas, Book 2 (Excerpts): No. 1, Sailor's Song, Hob. XXVIa:31 [Live]"
Franz Schubert,Die Salzburger Liederabende (Live),2019-02-01,track,"Schwanengesang, D. 957: No. 10, Das Fischermädchen"
Johann Sebastian Bach,Transcriptions for Trumpet & Organ,2019-06-07,track,"Prelude & Fugue in E Major, BWV 878: I. Preulde (Arr. for Trumpet & Organ)"
György Ligeti,Györgi Ligeti Masterworks,2019-04-26,track,Drei Phantasien nach Friedrich Hölderlin: III. Abenphantasie
Julius Röntgen,"Röntgen, Maier, Hägg & Others: Piano Works",2019-01-18,track,Walzer für das Pianoforte zu 4 Händen
