nombre_artista,album,fecha,tipo,track
Felix Mendelssohn,"Bruch, Mendelssohn & Massenet: Violin Works",2017-09-01,track,"Violin Concerto in E Minor, Op. 64, MWV O14: II. Andante"
Johann Sebastian Bach,Bach (Anders),2017-10-27,track,"Organ Concerto in C Major, BWV 594 (Arr. of Vivaldi's RV 522 for Trumpet & Chamber Ensemble): I. Allegro"
Endre Szervánszky,Hidden Gems,2017-02-03,track,Wind Quintet No. 1: IV. Allegro vivace
Clara Schumann,"Orgues du Jura franco-suisse, Vol. 2",2017-06-16,track,"3 Preludes & Fugues, Op. 16: Prelude No. 1 in G Minor"
Dimanche FR,A Collection of Masterpieces for Emotional Sympathy between Mother and Baby,2017-07-26,track,Sylbia - Ballet Suite - Intermezzo et Valse lente
Georg Philipp Telemann,Telemann: A Portrait,2017-02-24,track,"Sonate in B Major, TWV 40:107: I. Affettuoso"
Camille Saint-Saëns,Voyage,2017-11-08,track,オーボエ・ソナタ ニ長調 Op. 166 II. Allegretto
Giovanni Battista Pergolesi,Sacred Baroque Masterpieces,2017-09-01,track,"Stabat Mater, for Soprano, Alto, Strings and Organ in F Major: No. 11, Inflammatus et accensus. Allegro (Duet)"
Claude Debussy,Art of the Piano Etude,2017-05-29,track,"12 Études Book II, L. 136: No. 7, Pour les degrès chromatiques"
Johann Sebastian Bach,"Bach: The English Suites, BWV 806-811",2017-07-28,track,"English Suite No. 5 in E Minor, BWV 810: IV. Sarabande"
Gustav Mahler,"Michael Gielen Edition, Vol. 6: Mahler Symphonies & Orchestral Song Cycles (Recorded 1988-2014)",2017-09-08,track,"Lieder eines fahrenden Gesellen: No. 1, Wenn mein Schatz Hochzeit macht"
Lou Harrison,Composer-Critics of the New York Herald Tribune,2017-04-14,track,Suite for Cello & Harp: III. Interlude
Kjell Habbestad,Kjell Habbestad: Et Nox in Diem Versa,2017-10-06,track,"Cantica, Op. 1: I. Magnificat, Op. 1a"
Dimanche FR,Nationalistic Music Tour with Dvorak,2017-01-02,track,"Slavonic Danves, Op.72 - VIII. Sousedska. Grazioso e lento, ma non troppo, quasi tempo di Valse"
Jean Françaix,フランス室内楽作品集 －花房晴美 ライブ・シリーズIII－,2017-10-18,track,"オーボエ,ファゴット,ピアノのための三重奏曲　第4楽章フィナーレ"
Johann Sebastian Bach,Beyond,2017-12-14,track,"Suite for Cello Solo No. 2 in D minor, BWV 1008: 3. Courante (Performed on tuba)"
George Gershwin,55 Classical Piano Hits,2017-04-28,track,An American in Paris
Antonio Vivaldi,"Vivaldi: Il Bajazet, RV 703 (Live)",2017-01-06,track,"Il Bajazet, RV 703, Act III: Act III Scene 7: Signore, Bajazet ha bevuto il veleno"
Stephen Dodgson,"Dodgson: Chamber Music, Vol. 2",2017-03-17,track,String Quintet: III. Allegretto
Igor Stravinsky,Big Piano Box,2017-07-13,track,"Stravinsky: Serenade in A, i. Hymne"
Franz Liszt,Liszt: The Great Piano Works,2017-08-25,track,"Marche funèbre de Dom Sébastien de Donizetti, S.402"
Dimanche FR,Collection of Classical Masterpieces to Help Improve Learning,2017-02-06,track,Petite Symphonie - II. Andante cantabile
Nikolai Rimsky-Korsakov,Romances to Lyrics by Alexander Pushkin,2017-02-15,track,"4 Romances, Op. 42: III. The Clouds Begin to Scatter"
Arno Babadjanian,The Key Collection: 3 Centuries of Rare Keyboard Gems,2017-03-17,track,"6 Pictures: No. 3, Toccatina"
Wolfgang Amadeus Mozart,Fantasy,2017-09-20,track,"Fantasia in D Minor, K. 397"
Carl Philipp Emanuel Bach,Kinship,2017-09-08,track,"Harpsichord Sonata No.1 in A Minor, H.30 Wq.49: I. Moderato"
Claude Debussy,French Piano Music,2017-02-03,track,"Estampes, L. 100: No. 3, Jardins sous la pluie"
Reinhold Glière,Stokowski Plays the 20th Century,2017-02-17,track,"Symphony No. 3 in B Minor, Op. 42 ""Ilya Muromets"": II. Solovey the Brigand"
Johann Sebastian Bach,J.S. Bach: The Well-Tempered Clavier,2017-02-03,track,"The Well-Tempered Clavier, Book 2: Fugue No. 21 in B-Flat Major, BWV 890"
Ludwig van Beethoven,Beethoven: Complete Sonatas for Piano,2017-03-01,track,"Piano Sonata No. 9 in E Major, Op. 14, No. 1: III. Rondo - Allegro comodo"
Nikolai Roslavets,Roslavets: Complete Piano Works,2017-04-14,track,"3 Études: No. 1, Affettamente"
Fredrik Sixten,"Nordic Journey, Vol. 7",2017,track,Symphonia Aurora Borealis: II. Dawn
Georg Philipp Telemann,Telemann: Sacred Arias,2017-10-06,track,"Am zehnten Sonntage nach Trinitatis, TWV 1:1629a: Jammervolle Liebestränen!"
Cyril Scott,"Rubbra: Sinfonia concertante, Op. 38 & Violin Concerto, Op. 103",2017-08-04,track,Consolation
Alessandro Scarlatti,"Alessandro Scarlatti Collection, Vol. 2",2017-12-29,track,"Perchè tacete, regolati concenti?: II. Recitative"
Johann Sebastian Bach,Bach: Sei suonate à cembalo certato è violino solo,2017-03-10,track,"Violin Sonata No. 6 in G Major, BWV 1019: II. Largo"
Eugen d'Albert,"Cinderella: Works by Prokofiev, Rossini, d'Albert & Feeney",2017-05-12,track,"Aschenputtel, Op. 33: III. Ball im Königsschloss"
Johannes Brahms,"Brahms: Piano Concertos, Piano Works & Chamber Music",2017-11-17,track,"Brahms: Piano Trio No. 2 in C Major, Op. 87: II. Andante con moto"
Francesco Geminiani,Il Furibondo ou les tribulations d'un italien à Londres (Live at Paris),2017-04-28,track,"A Treatise of Good Taste in the Art of Musick: Song 4 ""O Bessy Bell"" - Live at Paris"
Randall Thompson,Thompson: Symphony No. 2 - S. Adams: Drift & Providence - Barber: Symphony No. 1,2017-06-09,track,Symphony No. 2 in E Minor: I. Allegro
Sigfrid Karg-Elert,The Ryemuse Collection: Organ Music from 23 British Instruments,2017-06-23,track,"66 Choral-Improvisationen, Op. 65, Book 6: No. 59, Nun danket alle Gott ""Marche Triomphale"""
Guillaume de Machaut,Rosa das rosas,2017-10-06,track,"Rose, liz"
Franz Schubert,La saison des fleurs,2017-03-01,track,"Vier Canzonen, D.688: II. Da quel sembiante appresi"
Ladislav Kubik,Kubík: Vocal Works,2017-12-08,track,To Be a Poet: I. Words
Antoine Reicha,"Reicha: Complete Piano Music, Vol. 3",2018-11-02,track,"Études ou exercices, Op. 30, Livre 2: No. 3, Andante un poco adagio"
Claude Debussy,Debussy - Tôn-Thât Tiêt,2018-10-19,track,"Fêtes galantes, L. 80: I. En sourdine"
Camargo Guarnieri,Canções Brasileiras,2018-11-10,track,Amo-te Muito
Dimanche FR,Comfortable Luxury Classical Collection for the Comfort of Your Heart,2018-10-18,track,"Images (Premiere Serie), L.110 - III. Mouvement"
Mark John McEncroe,My Symphonic Poems: Orchestral Images,2018-10-12,track,An Early Autumn Morning
Richard Wagner,Wagner: Der Ring des Nibelungen (Highlights),2018-11-13,track,"Die Walküre, WWV 86B, Act III (Highlights): Magic Fire Music - Wer meines Speeres Spitze fürchtet"
Reinhold Glière,Musical Mosaics,2018-09-07,track,"Romance in D Major, Op. 3"
Franz Liszt,LUX,2018-06-15,track,"Études d'exécution transcendante, S. 139: XI. Harmonies du soir"
Alessandro Scarlatti,A. Scarlatti: Oratorio per La Santissima Trinità,2018-01-26,track,"Oratorio per la santissima trinità, Pt. 2: XVI. Recitativo. ""Stolta sei"""
Edmund Rubbra,Macbeth: Music & Speeches,2018-03-20,track,Banqueting
Igor Shamo,Igor Shamo: Complete Piano Music,2018-12-28,track,Three Dances: I. Uzbek Dance
Johann Sebastian Bach,Bach: Keyboard Works,2018-03-16,track,"Goldberg Variations, BWV 988: Var. 30, Quodlibet"
Carlo Domeniconi,Domeniconi: Guitar Music,2018-04-13,track,"Don Quijote, Op. 123: V. Transfiguración y muerte"
Felix Mendelssohn,100 Sacred Choral Masterpieces,2018-05-04,track,"Elias, Op. 70, MWV A25 (Excerpts): No. 29, Siehe der Hüter Israels"
Igor Stravinsky,Portrait (Live),2018-01-05,track,"Symphony of Psalms, K052: II. Expectans expectavi Dominum - Live"
Gioachino Rossini,"Rossini: Piano Music, Vol. 10",2018-09-14,track,"Péchés de vieillesse, Vol. 1 ""Album italiano"": No. 10, Anzoleta dopo la regata"
Alessandro Scarlatti,A. Scarlatti: Sedecia re di Gerusalemme,2018-07-27,track,"Sedecia, re di Gerusalemme, Pt 1: XX. Aria. ""Vado"""
Lennox Berkeley,Lennox Berkeley: The Complete Piano Works,2018,track,"5 Short Pieces, Op. 4: No. 2, —"
Giovanni Benedetto Platti,Platti: Complete Music for Harpsichord and Organ,2018-04-27,track,"Sonata XI in C Minor, Op. 4 No. 5: I. Adagio"
Hadj Mohamed Tahar Fergani,Malouf - Saveurs Arabo-Andalouse,2018-04-11,track,Derhem
César Cui,Cui: Piano Transcriptions,2018-04-27,track,"Suite No. 2 in E Major, Op. 38 (Version for Piano 4 Hands): II. Quasi ballata"
Klaas de Vries,Zimmerman / Wagenaar / Van Geel / De Vries: Cinq our six Bagatelles Brillantes / Azulejos / Akhnaton,2018-10-09,track,"All That We Love Is Bound for the Past: Hush, Hush"
Gabriel Fauré,"Fauré: Requiem in D Minor, Op. 48 Duruflé: Requiem, Op. 9",2018-11-01,track,"Requiem, Op. 48 (version 1893, éditée par John Rutter) III. Sanctus"
Gabriel Fauré,Top 30 Most Popular Wedding Classics,2018-04-13,track,"Cantique de Jean Racine, Op. 11"
Felix Mendelssohn,"Decades - A Century of Song, volume 3",2018-09-21,track,Das Waldschloss
Ludwig van Beethoven,Emil Gilels Edition (1933-1963) [Live],2018-04-20,track,"Piano Sonata No. 3 in C Major, Op. 2 No. 3: III. Scherzo. Allegro - Trio (Live)"
Felix Mendelssohn,The Unbroken Circle,2018-09-07,track,"12 Gesänge, Op. 8: No. 8, Hexenlied, MWV K33 (Arr. P. Neal for Choir)"
Kenneth Hesketh,Hesketh: In ictu oculi — Orchestral Works,2018-11-02,track,Of Time and Disillusionment: II. Ritornelli
Johann Sebastian Bach,Bach: The Solo Cantatas for Bass,2018-04-20,track,"Ich will den Kreuzstab gerne tragen, BWV 56: II. Mein Wandel auf der Welt"
Johann Sebastian Bach,"Bach: Eternity (Cantatas BWV 20, 93, 3, 10, 116, 124)",2018-10-26,track,"Meine Seel erhebt den Herren, BWV 10: IV. Gewaltige stößt Gott vom Stuhl (Arie)"
Mario Gangi,Get Focused and Improve your Concentration with the Music,2018-09-05,track,Remembering
Johann Sebastian Bach,Orgelconcert,2018-01-15,track,"Orchester-Suite No. 3 D-dur, BWV 1068: Adagio (Arranged by Sigfrid Karg-Elert) - Live"
Sigfrid Karg-Elert,Organo-Orchestra Lingiardi 1877,2018-11-02,track,"33 Portraits, Book 1, Op. 101 (Arr. for Organ): No. 13, Offertorio [Alla Berlioz]"
Antonio Vivaldi,Vivaldi: Concertos,2018-03-02,track,"Flute Concerto in D Major, Op. 10 No. 3, RV 428 ""Il gardellino"": I. Allegro"
Johann Sebastian Bach,バッハ：ゴ-ルトベルク変奏曲／上杉春雄(ピアノ),2018-07-18,track,"ゴールドベルク変奏曲 ト長調, BWV 988: 第 13変奏"
Ludwig van Beethoven,Beautiful Beethoven,2018-03-09,track,"Beethoven: Piano Sonata No. 26 in E Major ""Les Adieux"" I. Adagio - Allegro"
Jean-Philippe Rameau,"4 Woods + 1 Sax Play Rameau, Mozart & Ravel",2018-10-12,track,"Suite in A Minor, RCT 5 (Arr. R. Hekkema for Reed Quintet): VIIc. Double II"
Maxim Shalygin,Shalygin: Lacrimosa or 13 Magic Songs,2018-06-03,track,Lacrimosa or 13 Magic Songs: X. Melancholia
Mark John McEncroe,"Musical Images for Piano: Reflections & Recollections, Vols. 1 & 2",2018-03-09,track,Shadows of an Old Memory
Wilhelm Friedemann Bach,Wilhelm Friedemann Bach Edition,2018-03-30,track,"Polonaise & Trio in C Major, F. 13"
Johann Sebastian Bach,50 Classical Violin Pieces,2018-06-22,track,"Violin Concerto in E Major, BWV 1042: III. Allegro assai"
Richard Wagner,"Wagner: Der fliegende Holländer, WWV 63 (Live)",2018-08-03,track,"Der fliegende Holländer, WWV 63, Act II: Mögst du, mein Kind, den fremden Mann willkommen heißen (Live)"
Dominick Argento,"Dominick Argento: The Boor, Miss Havisham's Wedding Night, A Water Bird Talk",2018-03-06,track,Miss Havisham's Wedding Night: Miss Havisham's dressing room.
Jan Ladislav Dussek,"Dussek: Sonatas, Op. 39 & Op.25 No.2",2018-04-27,track,"Sonata No. 1 in G Major, Op. 39 C.166: I. Allegro"
John McLeod,J. McLeod: Piano Music,2018-07-20,track,"Hebridean Dances: No. 2, Dance to Your Shadow"
Classical Meditation Players,Classical Hits Played Gently on Rhodes for Relaxation,2018-07-27,track,Pavane Pour Une Infante Défunte (For Piano) - Rhodes Mix
Joseph Haydn,Organ Music,2018-08-22,track,"Keyboard Concerto in C major, Hob.XVIII:8 : III. Finale, Allegro"
Bohuslav Martinů,"Satie: Complete Piano Works, Vol. 2",2018-01-12,track,"New Anthology, H. 288: No. 3, Longing"
Alexander von Zemlinsky,"Zemlinsky: Eine florentinische Tragödie, Op. 16 (Live)",2018-01-05,track,"Eine florentinische Tragödie, Op. 16: Ich heiße Guido Bardi (Live)"
Simon Mulligan,"American Songbook, Vol. 2",2018-12-14,track,How High the Moon
Johann Sebastian Bach,Bach: Works for Keyboard,2019-06-21,track,"15 Sinfonias (Excerpts): No. 4 in D Minor, BWV 790"
Ned Rorem,20th Century Harpsichord Concertos,2019-06-14,track,Concertino da camera: I. Allegro non troppo
Joseph Haydn,Sounds of Pannonia,2019-03-15,track,"String Quartet in C Major, Op. 54 No. 2, Hob. III:57: I. Vivace"
Wolfgang Amadeus Mozart,"Haydn: Mass in C Major, Hob. XXII:9 ""Missa in tempore belli"" - Mozart: Regina coeli, K. 276 (Live)",2019-03-22,track,"Regina coeli, K. 276 (Live)"
Ludwig van Beethoven,Piano Hits,2019-07-05,track,"Piano Sonata No. 23 in F Minor, Op. 57 ""Appassionata"": I. Allegro assai"
Claude Debussy,100 Best Children's Classics,2019-04-19,track,"Debussy: Estampes, CD 108, L. 100: No. 3, Jardins sous la pluie"
Claude Debussy,"Ce qu'a vu le vent d'Est: Debussy, Ibert, Otaka",2019-12-13,track,"Préludes, Livre 1: XI. La danse de Puck"
Sandeep Bhagwati,Sandeep Bhagwati: Miyagi Haikus,2019-03-15,track,"Miyagi Haikus III: No. 16, —"
Gioachino Rossini,Gioachino Rossini: Di piacer mi balza il cor (Transcription for Organ 4 Hands),2019-08-02,track,La gazza ladra: Overture - Transcription for Organ 4 Hands
Franz Schubert,"Vedi, quanto adoro ingrato, D. 510",2019-12-11,track,"Vedi, quanto adoro ingrato, D. 510"
Johannes Brahms,Brahms: Piano Trio No. 1,2019-10-18,track,"Piano Trio No. 1 in B Major, Op.8: 1. Allegro con brio"
Friedrich Wilhelm Rust,Rust: Piano Sonatas Nos. 7 & 12,2019-04-26,track,Piano Sonata No. 7 in D Minor: II. Andantino
Johann Sebastian Bach,Bach: The Secular Cantatas,2019-11-01,track,"Tilge, Höchster, meine Sünden, BWV 1083 (After Pergolesi's Stabat Mater): No. 6, Siehe! ich bin in Sünd empfangen"
Filippa Möres-Busch,Neue Welt,2019-07-05,track,Los pájaros perdidos (Arr. J. Parison)
João Domingos Bomtempo,Bomtempo: Complete Piano Sonatas,2019-06-14,track,"Piano Sonata in C Minor, Op. 5 ""Grande"": II. Minueto - Trio. Presto"
Alexandre Tansman,"Weinberg, Tansman & A. Tchaikovsky: Trios",2019-03-15,track,Piano Trio No. 2: II. Scherzo. Allegro vivace
Arturo Márquez,Serenata mexicana,2019-03-15,track,Dibujos sobre un puerto: V. Nocturno - Oración
Wolfgang Amadeus Mozart,Friedrich Gulda: The Stuttgart Solo Recitals (Live),2019-09-13,track,"Piano Sonata No. 14 in C Minor, K. 457: I. Molto allegro (Live)"
Milana Zilnik,"Milana Zilnik, Vol. 4",2019-01-07,track,Triumph of the Inner Child
Johann Sebastian Bach,J.S. Bach: Inventions & Duets,2019-11-15,track,"Duet No. 1 in E Minor, BWV 802 (1)"
Ernst von Dohnányi,The Year 1916 in Classical Music,2019-04-12,track,"Etudes de Concert, Op. 28: No. 6 in F Minor (Capriccio)"
Sandeep Bhagwati,Sandeep Bhagwati: Miyagi Haikus,2019-03-15,track,"Miyagi Haikus IV: No. 7, —"
Jacques Ibert,ALLURE,2019-05-16,track,アラベスク (カリニャーン)
Carlos Gardel,Carlos Gardel,2019-02-12,track,Paseo De Julio
Carl Philipp Emanuel Bach,Baroque Classics,2019-04-12,track,"Flute Concerto in D Minor, Wq 22: I. Allegro"
Nicolas Tzortzis,Les mystères,2019-11-01,track,...De ce qui est en lutte
Komitas,Toumanian Mek,2019-05-03,track,Khumar
Anton Bruckner,Sacred Choral Music,2019-04-05,track,"Ave Maria, WAB 6"
Francis Poulenc,55 Nocturnes,2019-05-31,track,"Huit Nocturnes, FP. 56: V. Phalenes"
Matteo Carcassi,カルカッシ 25のエチュード 作品60,2019-12-21,track,25のエチュード 作品60: 第16番
Paweł Łukaszewski,"Łukaszewski: Musica sacra, Vol. 9",2019-01-04,track,Beatus vir: VII. Gloria Gentis-Sanctus Sigismundus
Irina Mejoueva,Piano Recital Kyoto 2018,2019-05-31,track,"Chopin: 24 Preludes, Op. 28 - No. 1 in C Major - Live"
Dmitri Shostakovich,Duetos clássicos essenciais,2019-09-07,track,"Preludes, Op. 34a: No. 9 (Adagio)"
Ludwig van Beethoven,Song's First Cycle,2019-09-13,track,"An die ferne Geliebte, Op. 98: VI. Nimm die hin denn, diese Lieder"
Paul Hindemith,Hindemith: Complete Works for Violin & Piano,2019-04-05,track,"Viola Sonata, Op. 25 No. 2 ""Kleine Sonate"": II. Sehr langsam"
John Ireland,The Music of John Ireland,2019-04-26,track,Violin Sonata No. 2 in A Major: 3. In tempo moderato
Johann Sebastian Bach,"Bach, Haydn, Mozart & Handel: Piano Works",2019-09-06,track,"Goldberg Variations, BWV 988: Var. 24, Canone all'ottava"
Ludwig van Beethoven,Beethoven: String quartets,2019-11-30,track,"String Quartet No. 11 in F Minor, Op. 95 ""Serioso"": III. Allegro assai vivace, ma serioso"
Sir Clifford Curzon,"Mozart, Haydn, Schubert & Others: Orchestral Works",2019-03-15,track,"Piano Concerto No. 23 in A Major, K. 488: II. Adagio"
Geirr Tveitt,Salonnières,2019-02-22,track,Velkomne Med Ære
Johann Sebastian Bach,Bach: The Secular Cantatas,2019-11-01,track,"Amore traditore, BWV 203: No. 1, Amore traditore"
Ludwig van Beethoven,"Beethoven: 26 Welsh Songs, WoO 155",2019-11-29,track,"Beethoven: 26 Welsh Songs, WoO 155: No. 16, The Damsels of Cardigan"
Felix Mendelssohn,"Mendelssohn: The Collection, Vol. 1",2019-07-05,track,"String Symphony No. 8 in D Major, MWV N 8 (Version with Winds): IV. Allegro molto - Più presto"
Nedunuri Krishnamurthy,Hari Samarpana,2019-10-28,track,Devudu Thanalo Dandiguntudu
Fritz Kreisler,楽しい、クライスラーのヴァイオリン名曲集,2019-08-01,track,テンポ・ディ・メヌエット
Kosaku Yamada,思い出の歌、懐かしい曲 日本名歌集,2019-05-21,track,この道
William Sabatier,Piazzolla: Concertos & Chamber Works,2019-04-12,track,Loving
Gregory Spears,Gregory Spears: Paul's Case,2019-02-08,track,"Paul's Case, Act I Scene 2c: Years Ago I Walked Down the Aisle"
Carlos Gardel,La Tropilla,2019-02-09,track,La Gayola
Harold Truscott,Harold Truscott: Piano Sonatas,2019-10-31,track,"Piano Sonata No. 13, RC 104: I. Allegretto moderato"
Carl Nielsen,"The Launy Grøndahl Legacy, Vol. 4",2020-12-06,track,"Maskarade, FS 39, Act II: Se Henrik!"
Pancho Vladigerov,"Vladigerov: Orchestral Works, Vol. 1",2020-11-06,track,"Autumn Elegy, Op. 15 No. 2 (Version for Orchestra)"
Gabriel Fauré,Fauré: The French Organist,2020-10-10,track,"Trois mélodies, Op. 18: No. 1, Nell"
Richard Wagner,"Wagner: Götterdämmerung, WWV 86D",2020-07-24,track,"Götterdämmerung, WWV 86D / Act III Scene 3: Starke Scheite schichtet mir dort"
George Frideric Handel,"Handel: Messiah, HWV 56 (1742 Version)",2020-04-03,track,"Messiah, HWV 56, Pt. 1 (1742 Version): No. 18, Rejoice Greatly, O Daughter of Zion"
Johann Sebastian Bach,Classical Hits de Natal,2020-11-14,track,"Christmas Oratorio, BWV 248, Cantata 1: Choral: Wie soll ich dich empfangen (Chorus)"
Antoinette Tredanary,"Traditional Christmas, Vol. 2",2020-12-07,track,Ave Maria
Zygmunt Stojowski,Zygmunt Stojowski - Complete Works for Cello & Piano (World Premiere Recording),2020-09-01,track,Romance sans parole for Cello and Piano in A Major
Rahul Vellal,Balambikaya Param,2020-06-27,track,Balambikaya Param
Carl Czerny,"Czerny for Ballet Class, Arrangements and Re-Imaginings, Pt. Three, Op. 740 - 1st Series: Studies 1-15",2020-03-10,track,"Study in F Major Op. 740: No. 11, Third Version"
Dietrich Buxtehude,"Buxtehude: Orgelwerke, Vol. 1",2020-11-13,track,"Canzon in C Major für Orgel, BFK 32"
Jan Ladislav Dussek,"Dussek: Complete Piano Sonatas, Op. 14 Nos. 1-3, Vol. 9",2020-11-27,track,"Sonate Pour Le Clavecin Où Le Forte-Piano in G Major, WoO, C.40: I. Larghetto col espressione"
Pierre Boulez,French Piano Rarities,2020-05-22,track,"Prélude, Toccata & Scherzo: II. Toccata"
Johannes Brahms,Brahms: Piano Quartets Nos. 1-3,2020-06-05,track,"Piano Quartet No. 2 in A Major, Op. 26: I. Allegro non troppo"
Karol Szymanowski,Femmes fatales: Soprano Heroines from the Orient,2020-02-14,track,"Songs of the Fairy Tale Princess, Op. 31, M. 32 (Version for Voice & Orchestra) [Excerpts]: No. 4, Taniec"
Dmitry Kabalevsky,Kabalevsky: Complete Preludes,2020-06-05,track,"6 Preludes & Fugues, Op. 61: No. 6, A Feast of Labor"
Claude Debussy,Le Chevalier Malheur (Mélodies après Paul Verlaine),2020-03-06,track,"Ariettes oubliées, L. 60: No. 2, Il pleure dans mon cœur"
Ludwig van Beethoven,Beethoven: Orchestral Works (Live),2020-07-17,track,"Symphony No. 5 in C Minor, Op. 67: I. Allegro con brio (Live)"
Ludwig van Beethoven,This is Beethoven,2020-10-03,track,"Piano Sonata No. 23 in F Minor, Op. 57 ""Appassionata"": II. Andante con moto"
Johannes Brahms,Poetik des Untergangs,2020-09-04,track,"Symphony No. 4 in E Minor, Op. 98 (Version for 2 Pianos): III. Presto giocoso"
Percy Whitlock,Whitlock & Stewart: Works for Organ,2020-08-28,track,"6 Hymn-Preludes, Book 1: No. 2, Song 13 (After O. Gibbons)"
Michael Daugherty,Michael Daugherty: This Land Sings (Inspired by the Life and Times of Woody Guthrie),2020-05-08,track,"This Land Sings (Inspired by the Life and Times of Woody Guthrie): No. 17, Wayfaring Stranger [900 Miles]"
Milana Zilnik,Piano Instrumental – Melody for Deep Concentration,2020-06-03,track,Ripples on the Water
Wolfgang Amadeus Mozart,Mozartiana: Rarities & Arrangements Performed on Historical Keyboards,2020-11-13,track,"Adagio in B Minor, K. 540"
Franz Liszt,Liszt: Piano Works,2020-08-21,track,"Alte deutsche geistliche Weisen, S. 50 (Excerpts): No. 7, Wer nur den lieben Gott läßt walten"
Ludwig van Beethoven,Piano Works of the Young Beethoven,2020-06-05,track,"Piano Sonata No. 18 in E-Flat Major, Op. 31 No. 3: I. Allegro"
Johannes Brahms,Brahms: Songs & Duets,2020-10-02,track,"Von ewiger Liebe, Op. 43 No. 1"
Adam Johnson,Savage Piano,2020-02-12,track,Fanfare II
Wolfgang Amadeus Mozart,"Mozart, Beethoven & Schubert: Orchestral Works",2020-06-19,track,"Die Entführung aus dem Serail, K. 384: Overture"
Muzio Clementi,Clementi: Piano Works,2020-06-26,track,"Musical Characteristics, Op. 19: Cadenza No. 6, Alla Clementi"
Wolfgang Amadeus Mozart,Mozart: Piano Works,2020-01-10,track,Larghetto & Allegro in E-Flat Major (Completed by P. Badura-Skoda)
Arthur Somervell,Somervell: Maud & A Shropshire Lad,2020-05-15,track,Shepherd's Cradle Song
Ludwig van Beethoven,Celebrate Beethoven: Greatest Hits,2020-12-04,track,"Violin Sonata No. 9 in A Major, Op. 47 ""Kreutzer"": III. Finale. Presto"
Ludwig van Beethoven,100 Classical Piano Pieces,2020-07-25,track,"Piano Quartet No. 3 in C Major, WoO 36: III. Allegro"
Nikolai Rimsky-Korsakov,Rimsky-Korsakov: Complete Operas & Fragments,2020-09-18,track,"The Maid of Pskov, Act III Scene 2: Recitative & Arioso of Olga"
Antonio Vivaldi,Vivaldi at Home,2020-10-13,track,"Concerto for 2 Mandolins in G Major, RV 532: II. Andante"
Nikolai Obukhov,Sound Review 1/6,2020-12-02,track,"Ten Psychological Pictures for Piano (1915): No. 2, Mystère"
Camille Saint-Saëns,Classical Music at the Movies,2020-02-15,track,"Samson et Dalila, Op. 47, Act II: Mon coeur s'ouvre a ta voix"
Johann Adolf Hasse,Hasse: Artaserse (Live),2020-03-06,track,"Artaserse, Act I Scene 15: Arbace, Arbace, ah se veder potessi (Live)"
Wolfgang Amadeus Mozart,"Mozart: Piano Concerto No. 17 in G Major, K. 453",2020-07-10,track,"Piano Concerto No. 17 in G Major, K. 453: II. Andante"
Jehan Alain,"Variations sur un thème de Clément Janequin, JA 118",2020-10-06,track,"Variations sur un thème de Clément Janequin, JA 118"
Isaac Albéniz,Albéniz: The Spanish Composer,2020-10-10,track,"Recuerdos de Viaje, Op. 71: VI. Rumores de la caleta - Malagueña (Arr. for Guitar)"
Ludwig van Beethoven,The Warner Recordings 1934-1970,2020-10-30,track,"Beethoven: Piano Concerto No. 3 in C Minor, Op. 37: I. Allegro con brio"
Paul Hindemith,"Hindemith: Suite 1922, Op. 26 & Piano Sonatas Nos. 1-3",2020-09-04,track,Piano Sonata No. 3 in B-Flat Major: II. Sehr lebhaft
Johann Sebastian Bach,"J.S. Bach: Orgelbüchlein, BWV 599–644",2020-04-03,track,"Wenn wir in höchsten Nöten sein, BWV 641"
Virgil Thomson,"Thomson: Portraits, Self-Portraits & Songs",2020-10-23,track,Sonata for Violin & Piano: III. Tempo di valzer
Sunleif Rasmussen,Andalag,2020-02-28,track,Viola Sonata No. 1: V. Espressivo
Franz Liszt,Schubert & Liszt: Works,2020-01-17,track,"12 Lieder von Franz Schubert, S. 558 (Excerpts): No. 2, Auf dem Wasser zu singen"
Arnold Rosner,Arnold Rosner: The Masses,2020-02-07,track,"Missa in nomine, Op. 62: V. Agnus Dei"
Felix Mendelssohn,Minimal Afternoon,2020-08-15,track,"Songs without Words, Op. 19: No. 6 in G Minor 'Venetian Gondola Song' (Andante sostenuto)"
Richard Wagner,"Wagner: Die Meistersinger von Nürnberg, WWV 96 (Semperoper Edition, Vol. 6)",2016-09-30,track,"Die Meistersinger von Nürnberg, WWV 96, Act III: Overture"
Franz Schubert,Erna Berger,2016-01-01,track,"Im Abendrot, D. 799"
Franz Schubert,Ladies Only,2016-09-15,track,"Lied der Anne Lyle, D.830"
George Frideric Handel,100 Best: Handel,2016-06-10,track,"Concerto Grosso in F Major, HWV 320: III. Largo"
César Franck,"Franck, Poulenc, Fauré: French Works for Violin and Piano",2016-12-09,track,"Violin Sonata in A Major, FWV 8: IV. Allegretto poco mosso"
Joseph Haydn,Szell: Symphony No. 93 & Symphony No. 5,2016-07-01,track,"Symphony No. 93 in D Major, Hob. I:93: III. Menuet"
Johann Sebastian Bach,"J.S. Bach: Sonatas and Partitas, BWV 1001–1006",2016-02-01,track,"Violin Partita No. 1 in B Minor, BWV 1002: IV. Double. Presto - Arr. for Cello"
George Frideric Handel,"Handel: Giulio Cesare in Egitto, HWV 17 (Sung in German)",2016-01-01,track,"Giulio Cesare in Egitto, HWV 17 (Sung in German), Act III: Lange sucht' ich Ptolemäus"
Olivier Messiaen,Messiaen: The Complete Organ Works,2016-11-11,track,"L'ascension, I/12b (Version for Organ): I. Majeste du Christ demandant sa gloire a son Pere"
Johann Sebastian Bach,Bach: The Well Tempered Clavier (Complete),2016-06-10,track,"The Well-Tempered Clavier, Book 2: Prelude & Fugue No. 14 in F-Sharp Minor, BWV 883"
Georg Philipp Telemann,"Telemann Edition, Vol. 6",2016-12-09,track,"Passions-Oratorium, das Selige Erwägen des bittern Leidens und Sterbens Jesu Christi, TWV 5:2: Aria. Tränen, die der Glaube"
